_unit_id,_unit_state,_trusted_judgments,_last_judgment_at,write_a_coherent_question_that_would_result_in_the_answer_shown_above_do_not_copy_the_sample_question_,answers,questions,write_a_coherent_question_that_would_result_in_the_answer_shown_above_do_not_copy_the_sample_question__gold
2721199935,finalized,3,4/20/2020 22:12:18,"Should we leave the chalet before March 29?
Should you leave a hotel or stay for the world health problem regarding the covid 19?
Should the tenants shorten their stay and leave the chalet immediately?","Whether in a chalet, a resort or any other tourist establishment covered by this measure, the stay does not have to be shortened if it began before March 29, 2020, but it may not be extended.
 The public health directives must be respected:
 •  Avoid visiting any stores and other public destinations.
•  Do not hold indoor or outdoor gatherings.
",Must tenants who already occupy a chalet leased before March 29 shorten their stay and leave immediately?,
2721199936,finalized,3,4/20/2020 20:41:58,"Is there a defined time for the suspension and closure of establishments?
May tenants who leased a chalet several weeks ago to stay there between March 29 and May 4, 2020 go there on pandemic?
Does it have a negative impact on travel and reservations in this crisis of the covid?","No. All reservations made with tourist accommodation establishments covered by this measure for stays between March 29 and May 4, 2020 inclusive must be cancelled. It is also possible to postpone a reservation, but it is important to bear in mind that this could be postponed or cancelled again if the public health measures must be extended.
 ","May tenants who leased a chalet several weeks ago to stay there between March 29 and May 4, 2020 go there?",
2721199937,finalized,3,4/20/2020 20:46:18,"Should reservations be canceled for July?
I have the reservation of a tourist residence scheduled after the month of may should i cancel it?
Do I have to cancel a tourist residence reservation for a stay that was already scheduled for July of the current year?","If the reservation is scheduled for a date after May 4, 2020, it may be maintained for the time being. It is important to bear in mind that this could be postponed or cancelled again if the public health measures must be extended.
 ",Must the reservation of a tourist residence for a stay scheduled in July be cancelled?,
2721199938,finalized,3,4/20/2020 20:46:18,"What are my responsibilities to those who reserve rooms in my rooms?
I  had leased my tourist residence through Airbnb but the tenants cancelled the reservation, what should i do?
What are my obligations to tenants who have already leased their tourist residence?","Consult the policy of the collaborative accommodation platform in question. Most have agreed on support measures in relation to the current health crisis or provided for force majeure clauses.
 ","I had leased my tourist residence through a collaborative accommodation platform (such as Airbnb); however, the tenants cancelled the reservation. What are my obligations to the tenants?",
2721199939,finalized,3,4/20/2020 20:33:34,"What are the preventive measures to avoid the spread of Coronavirus?
How can I make sure surfaces are cleaned properly to get rid of the COVID-19 virus
How can i protect myself and my falmily from the COVID-19","The coronavirus (COVID-19) can survive on objects and surfaces from a few hours to a few days.
 Its lifecycle is:
 •  3 hours on objects with dry surfaces;
•  6 days on objects with moist surfaces;
It is therefore important that you wash the counters, sinks, doorknobs and all surfaces frequently touched by hands. Cleaning and disinfection are very effective to eliminate the virus. Use water and soap or household cleaning products and a disinfectant solution for this purpose.
 For more information, go to https://cdn-contenu.quebec.ca/cdn-contenu/sante/documents/Problemes_de_sante/19-210-30A_Guide-auto-soins_anglais.pdf?1584985885  .
 ",Occupants recently left my tourist residence. What are the preventive measures to take to protect my family and me from COVID-19?,
2721199940,finalized,3,4/20/2020 21:19:24,"Regarding the tourist events, what measures are being offered?
Will the organizations benefiting from the Festivals and Tourism Events Financial Assistance Program receive their first installment, even if they stopped their activities?
What kind of financial aid will they give for tourist events and festivals?","All organizations benefiting from the Festivals and Tourism Events Financial Assistance Program during the summer/fall 2020–2021 period will receive their first instalment (80% of the total grant amount) whether their activities have continued or not.
 If applicable, the second instalment of up to 20% of the financial assistance will be disbursed based on the expenses incurred at the time the event is cancelled, upon receipt of supporting documents. Any amount paid in excess of the total costs incurred (including event-related expenses incurred after the cancellation date) will be recovered as required. Note that the total amount of government assistance will also be taken into account.
 ",What relief measures are being provided under the Festivals and Tourism Events Financial Assistance Program?,
2721199941,finalized,3,4/20/2020 20:45:31,"how much will the financial assistance payment be
What would be the percentage of the first payment of financial assistance?
When will I receive my first financial aid?","As in previous years, the first payment, amounting to 80% of the financial assistance, will be disbursed after the agreement has been signed.
 ",When will the first financial assistance instalment be made?,
2721199942,finalized,3,4/20/2020 21:40:27,"What a festival needs to apply to the financial assistance program?
What festivals and events may be eligible for relief measures?
Is it possible to carry out some kind of event to help people?","To take advantage of these relief measures, the promoter must have obtained financial assistance through the Festivals and Tourism Events Financial Assistance Program for a festival or an event to be held between May 1 and October 31, 2020. These ad hoc measures have been adopted due to the exceptional circumstances of the COVID-19 pandemic.
 Events that were scheduled to take place in March and April 2020, but were cancelled due to COVID-19 will also benefit from these measures.
 ",What festivals and events are eligible for the relief measures?,
2721199943,finalized,3,4/20/2020 21:05:28,"Will financial payments be canceled?
How will the second installment of financial assistance be paid?
Any amount paid in excess of the total costs incurred including event-related expenses incurred after the cancellation date will be refunded as required....","The second instalment of up to 20% of the financial assistance will be disbursed based on the expenses incurred at the time the event is cancelled, upon receipt of supporting documents. Any amount paid in excess of the total costs incurred (including event-related expenses incurred after the cancellation date) will be recovered as required. Note that the total amount of government assistance will also be taken into account.
 ",How will the rest of the financial assistance be paid out?,
2721199944,finalized,3,4/20/2020 22:14:36,"Are financial aid applications being reviewed during this pandemic?
Before the pandemic make a request for financial assistance and would like to know the status?
How will the deadlines for financial aid applications be?","Financial assistance applications are still being reviewed in spite of the pandemic. You should get a response within the next few weeks.
 ",Will financial assistance applications submitted to the ministry be processed within the usual timeframe?,
2721199945,finalized,3,4/20/2020 21:32:09,"If I have an event that was due to take place between a certain date period and must be canceled. Will this affect the publicity of the event in the future?
Will it have an impact on a financial event that is canceled and is scheduled in the coming months, if it is held for the following years?
by what date will the latest tourism study be launched and what will be its impact on the country","Given this exceptional situation, businesses will not be required to submit a new provenance or attendance study, for example, when submitting applications for the summer/fall period of the 2021–2022 fiscal year. If necessary, the latest available study will be deemed valid by Ministère du Tourisme.
 ","If an event receiving financial assistance and scheduled to take place between May 1 and October 31, 2020, is cancelled, will this have an impact on applications for 2021–2022 (e.g., submission of a new provenance or attendance study)?",
2721199946,finalized,3,4/20/2020 21:20:25,"How long do they negotiate the Financial Assistance Program for festivals and tourist events?
As a result of COVID-19, is the Communications Department of the Ministère du Tourisme asking for the negotiation of a new visibility agreement?
What will the process of the Festival Financial Assistance Program be like?","In light of the current COVID-19 pandemic, the Communications Department of Ministère du Tourisme is not calling for the negotiation of a new visibility agreement. If the festival or event is held, last year’s visibility agreement will apply. If financial assistance is being provided for the first time, the Communications Department will contact the festival or event promoter to reach a verbal visibility agreement.
 ",Does the visibility agreement provided for under the Festivals and Tourism Events Financial Assistance Program need to be renegotiated?,
2721199947,finalized,3,4/20/2020 21:40:27,"Will financial assistance apply in 2021?
Can financial assistance or canceled postponed events be transferred to the next year 2021?
Can next year's events receive some form of financial assistance?","The financial assistance granted applies only to costs incurred for the 2020 edition, whether the event is cancelled or not.
 Promoters will be able to submit new financial assistance applications for 2021 events this fall.
 ",Can financial assistance for postponed or cancelled festivals and events be transferred to the 2021 edition?,
2721199948,finalized,3,4/20/2020 21:12:08,"Is an intervention plan required on pandemic?
that the government plans to prevent further expansion of Covid-19
What plan is the Québec government developing for its employees during the pandemic?","Yes, it is recommended that a specific plan be developed in the event of an outbreak or pandemic. The Gouvernement du Québec has prepared a guide to support the municipal sector in this regard
 •  https://cdn-contenu.quebec.ca/cdn-contenu/adm/min/affaires-municipales/publications-adm/documents/COVID-19/Gui_Coronavirus_Muni_ENG.pdf?1586190697 
Even if they have not developed such a plan, municipalities can take all the measures they deem necessary to protect their employees and ensure the continuity of essential services.
 ",Is an intervention plan required?,
2721199949,finalized,3,4/20/2020 21:29:44,"Are there different or equal rules for both public employees and municipal staff?
None, Municipalities is encouraged to adopt measures similar to those applied to public servants to reduce the risk of spreading the coronavirus among its employees.
Should municipality adopt measures in order to limit the risk of spreading the covid-19?","No. However, municipalities are encouraged to adopt measures similar to those applicable to public service staff to limit the risk of coronavirus spread among their employees.
 ",Do the standards for public service employees apply to municipal staff?,
2721199950,finalized,3,4/20/2020 21:57:16,"How do I know if my company should remain open or closed during the emergency?
In the municipality, which priority services should be maintained?
What are the services of a community that must continue to operate normally in the face of this emergency?","The government has ordered the closure of all non-priority businesses and services from March 24 to April 13, 2020.
 While leaving municipal organizations the leeway to identify the resources they consider essential and whose services need to be maintained (for example, services provided by the administration or certain other activities such as public works or housing), the government has identified a list of https://www.quebec.ca/en/health/health-issues/a-z/2019-coronavirus/essential-services-commercial-activities-covid19/ .
 In municipalities, the priority services and activities that must be maintained - whether they are carried out by the municipalities themselves or by firms with which a contract has been signed - include the following:
 •  police services
•  fire departments
•  the dispatch centres of a police force or fire department
•  the 911 call service
•  waste collection and disposal services
•  services for the collection and sorting of recyclable materials
•  hazardous materials collection and processing services
•  organics collection and treatment services, including septic tank emptying
•  biomedical waste collection and treatment services
•  pest management companies (for the control of bed bugs, rats, and mice in particular)
•  water and sewage treatment services
•  public transit and paratransit services
•  snow removal services
•  power generation activities
•  road and other municipal infrastructure maintenance activities
These measures are intended to minimize the risk of spreading COVID-19 that could result from activities involving contact between a number of people, while ensuring that essential services and activities are maintained.
 It should be noted that telework is still permitted at all times for all services and activities of municipal organizations.
 The authorities are closely monitoring the situation and will inform the public of any new provisions that have to be respected.
 ",Which priority municipal services have to be maintained?,
2721199951,finalized,3,4/20/2020 22:14:36,"that municipal employees will be able to quarantine
who are eligible for emergency child care services in the municipality
What are the requirements to be a municipal employee?","Decree 177-2020 (13 March 2020), Order 2020-004 (15 March 2020) and Order 2020-005 (17 March 2020) specify the job categories with access to emergency childcare services. Certain job categories are more specifically related to the municipal sector.
 In the case of an outsourced essential service, the personnel of the provider covered by the above-mentioned employment categories may also be eligible for emergency childcare services. In such cases, the chief executive officer of the company must determine which personnel provide services deemed essential.
 A complete list of essential jobs and services is available https://www.quebec.ca/en/health/health-issues/a-z/2019-coronavirus/essential-services-commercial-activities-covid19/ ",Which municipal employees are eligible for emergency childcare?,
2721199952,finalized,3,4/20/2020 21:25:22,"Due to the pandemic, could measures be taken through the government?
because the ministers are taking corresponding measures in the area?
What is the role of the Minister of Health and Social Services during health emergency?","The Minister of Health and Social Services is responsible for the Public Health Act. When the government declares a health emergency, the Minister has the necessary powers to impose new rules and adapt existing rules to the situation. Discussions have taken place between the Minister of Municipal Affairs and Housing and the Minister of Health and Social Services concerning the exceptional measures required for the municipal sector.
 ",Why is the Minister of Health and Social Services adopting measures for municipalities?,
2721199953,finalized,3,4/20/2020 22:13:01,"Has the government done anything to help ensure public health?
What are the basis for choosing exceptional measures?
If I wait for my income situation to stabilize before asking for a support payment modification, can my income reduction during the pandemic be taken into account?","The Gouvernement du Québec has established a list of priority measures to ensure the health of the population in all Quebec municipalities. The measures selected ensure that municipalities will continue to exercise their responsibilities by adapting certain rules to the exceptional situation facing the population of Québec.
 ",How were the exceptional measures determined?,
2721199954,finalized,3,4/20/2020 21:59:17,"Could other measures be added to those already set out?
Is The Gouvernement du Québec alone in monitoring and controlling this pandemic?
Could other security measures be added to those already established by the pandemic?","Other measures are not ruled out. The Gouvernement du Québec is closely monitoring the situation in conjunction with the authorities concerned.
 ",Could other measures be added to those already set out?,
2721199955,finalized,3,4/20/2020 21:49:28,"If a health emergency is declared to have newly elected officials?
Elected officials must comply with the decrees stipulated in the health emergency due to COVID-19?
Is there any restrictions to the elected officials in the way that can declare any health emergency or any order problem if they consider that is the best option?","Municipal elected officials must comply with the applicable laws, decrees, directives, and by-laws and exercise their powers within this legal and regulatory framework.
 ",Do elected officials have general discretionary power under the decree declaring a health emergency and ministerial orders issued pursuant thereto?,
2721199956,finalized,3,4/20/2020 21:37:46,"Can a mayor exceed expenses to safeguard the lives of citizens?
In this case, the mayor of the municipality must assume any responsibility and problem that leads the population to harm, making humanitarian aid and collaborating with the sick.
When should the mayor enact his regulations?","Sections 573.2 of the Cities and Towns Act and 937 of the Municipal Code of Québec stipulate that in the case of irresistible force of such a nature as to imperil the life or health of the population or to seriously damage the municipal equipment, the head of the council (mayor of a municipality or warden of an RCM) may order any expenditure he or she considers necessary and award any contract necessary to remedy the situation. This power should therefore be used only under such conditions and only as an exceptional measure. For the sake of transparency and sound public management, it is also suggested that it be used only in cases where the urgency of the situation does not allow the council to make a decision in a timely manner and according to the usual contractual rules.
 Otherwise, the municipality's expenditures and contracts must be authorized by council, subject to the adoption of a by-law delegating to a municipal official the power to authorize expenditures and enter into contracts in the name of the municipality pursuant to sections 477.2 of the Cities and Towns Act and 165.1 of the Municipal Code of Québec.
 It should also be noted that sections 573.2 of the Cities and Towns Act and 937 of the Municipal Code of Québec provide that the mayor of the municipality or the warden of the RCM, as the case may be, must report to council on the use of his or her power to decree expenditures and award contracts at the first meeting of council that follows.
 ",Under what circumstances should the mayor of a municipality use his or her power to decree any expenditure and award any contract in accordance with section 573.2 of the Cities and Towns Act and section 937 of the Municipal Code of Québec?,
2721199957,finalized,3,4/20/2020 21:19:24,"Is it possible to declare a state of emergency by COVID-19?
Which person has to authorize the local state of emergency?
Can a municipality declare an emergency different from the one that is already established?","Pursuant with the declaration of a state of health emergency by the gouvernement du Québec, the series of measures established by government decrees and ministerial orders of the Minister of Health and Social Services, and the importance of ensuring full and complete consistency between government interventions, those of the Direction nationale de la santé publique and those of municipalities, the latter cannot declare a local state of emergency without first obtaining the authorization of the National Director of Public Health. This particular condition is the subject of Order No. 2020-014 adopted on April 2, 2020.
 In the event that a declaration of a state of local emergency is adopted in accordance with the conditions set out above, section 47 of the Civil Protection Act provides that the municipality may exercise specific powers to protect the life, health, or integrity of persons. In exercising the specific powers granted to it by virtue of a state of local emergency, the municipality must, however, in accordance with Order No. 2020-014, comply with any conditions that the National Director of Public Health may set, including any restriction on one or more of these powers.
 It is essential to aim for the greatest possible congruence between measures to be taken by municipalities and those taken by the government. This will make it easier to achieve the benefits sought by all these measures, which are intended to ensure the best possible protection of public health.
 ",Can a municipality declare a local state of emergency under current COVID-19 health emergency conditions?,
2721199958,finalized,3,4/20/2020 22:12:46,"municipalities must purchase protection implements to protect their employees
Scream masks. In particular, clinical activities that generate much aerosol are reserved.
Should my municipality purchase N95 mask?","Municipalities should avoid purchasing N95 masks and other similar equipment since they are intended primarily for use in health care facilities. N95 masks, in particular, are reserved for clinical activities that generate a lot of aerosols.
 You can find more information on https://www.quebec.ca/en/health/health-issues/a-z/general-information-about-coronavirus/#c53183 section.
 ",Should municipalities purchase N95 masks and other similar medical equipment to protect their employees?,
2721199959,finalized,3,4/20/2020 22:19:15,"What are the exceptional measures that I should take into account?
COVID-19 pandemic is an exceptional event that requires exceptional measures, aimed at stemming the spread of disease and protecting the population, while allowing society to continue to operate as naturally as possible.
The goal is to curb the spread of disease and protect the population, while allowing the community to continue to operate as naturally as possible.","The COVID-19 pandemic is an exceptional event that requires exceptional measures, with the aim of curbing the spread of the disease and protecting the population, while allowing society to continue to function as normally as possible.
 ",Do the special rules provided for in the government decree and the ministerial orders infringe on the rights of citizens?,
2721199960,finalized,3,4/20/2020 20:49:50,"Is municipal autonomy maintained or does each municipality have to abide by the special rules established in the government decree and the ministerial decree?
how to protect the population from the pandemic and that will be applied to society that does not comply with the prevention rules
What are the special measures that I should consider?","The COVID-19 pandemic is an exceptional event that requires exceptional measures, with the aim of curbing the spread of the disease and protecting the population, while allowing society to continue to function as normally as possible.
 The role of municipalities is essential in dealing with this pandemic. Several of the rules set out in the ministerial orders are intended to give them the latitude to act quickly and effectively in a context of uncertainty and risk.
 ",Do the special rules provided for in the government decree and the ministerial decree infringe on municipal autonomy?,
2721199961,finalized,3,4/20/2020 20:46:18,"Is it possible for the state to allocate a food assistance fund?
Can a food assistance fund be established and managed by a municipality?
What are the chances that a municipality or state will administer a food assistance fund?","Yes, municipalities have the authority to establish and manage a food assistance fund. The Municipal Powers Act stipulates, among other things, that a municipality may provide assistance to help people in need, or to support a charitable organization.
 ",Is it possible for a municipality to establish and manage a food assistance fund?,
2721199962,finalized,3,4/20/2020 20:45:31,"where can I find The list of Québec municipalities
Where can the municipalities recognized by Revenu Québec and the Canada Revenue Agency be verified to issue a tax receipt?
Will municipal taxes be collected from the inhabitants during this period of inactivity?","To issue tax receipts to citizens who contribute to a food assistance fund it has set up, the municipality must be a donee recognized by Revenu Québec and the Canada Revenue Agency.
 The list of Quebec municipalities that are qualified donees is available on the https://www.canada.ca/en/revenue-agency/services/charities-giving/other-organizations-that-issue-donation-receipts-qualified-donees/other-qualified-donees-listings/list-municipalities-quebec.html ",Is it possible for a municipality to issue tax receipts to citizens who contribute to such a fund?,
