_unit_id,_unit_state,_trusted_judgments,_last_judgment_at,write_a_coherent_question_that_would_result_in_the_answer_shown_above_do_not_copy_the_sample_question_,answers,questions,write_a_coherent_question_that_would_result_in_the_answer_shown_above_do_not_copy_the_sample_question__gold
2721199630,finalized,3,4/20/2020 22:12:18,"How do I know what a Health emergency is?
What does this global health emergency mean?
What is an emergency or health emergency?","A health emergency can be declared when a threat to the health of the population demands the immediate application of certain measures. It empowers the Québec government and the Ministère de la Santé et des Services sociaux to implement an array of measures to protect the health of the population.
 The Ministère de la Santé et des Services sociaux could, for example, promptly purchase equipment or conclude the necessary contracts to protect the health of the population.
 ",What is a health emergency?,
2721199631,finalized,3,4/20/2020 21:16:50,"Does the Quebec government declare a health emergency demonstrate commitment to its citizens?
How many times before has Quebec declared a health emergency?
The Quebec government took action on this global emergency?","Yes. This exceptional measure demonstrates the Gouvernement du Québec’s determination to adopt the necessary measures to protect Quebecers.
 ",Is this the first time that Québec has declared a health emergency?,
2721199632,finalized,3,4/20/2020 21:54:01,"How to know when the COVID-19 pandemic has reached its peak?
How to know that a pandemic reaches its worst point
¿when the pandemic reaches its peak?","A pandemic peaks when, after a significant rise in cases, the number of new cases stops growing and starts to decrease.
 ",How will we know when the pandemic has peaked?,
2721199633,finalized,3,4/20/2020 21:39:16,"Where can I receive information about this?
Which are the reliable sources to inform me?
Where could I get information about the pandemic situation?","For up-to-date information, consult the Government of Quebec’s official website often https://www.quebec.ca/en/health/health-issues/a-z/2019-coronavirus/ .
 Listen to the radio or watch television and read newspapers. The Ministère de la Santé et des Services sociaux will be providing health guidelines for the public to follow and information about where to get treatment.
 Always follow government advisories and instructions. Advisories and instructions may change as the situation unfolds.
 To learn how to recognize a credible source of information, go to the page https://www.quebec.ca/en/health/advice-and-prevention/accidents-injuries-and-diseases-prevention/how-to-recognize-a-reliable-source-of-information-on-health/ .
 ",Where can I get information about the situation?,
2721199634,finalized,3,4/20/2020 20:15:49,"Can pregnant women who are giving birth be accompanied by a family member?
Is it necessary for a woman about to give birth to be accompanied by a loved one?
Can the husband/coach of a pregnant woman accompany her to the hospital?","At present, pregnant women can be accompanied by a loved one when giving birth in Québec hospitals. However, hospitals may adopt certain specific measures, as is the case at the Montreal Jewish General Hospital. To obtain additional information in this regard, pregnant women can contact their hospital.
 ",Can pregnant women who are giving birth be accompanied by a loved one?,
2721199635,finalized,3,4/20/2020 20:49:50,"What are the steps I should take if I am returning from a trip?
What should I do if I have a cold system and difficulty breathing
If I am traveling, should I isolate myself when I return?","Anyone returning from a stay outside Canada must self-isolate for 14 days. Such isolation covers both travellers who are sick or display symptoms and those who do not have symptoms and are in perfect health.
 Individuals in self-isolation must stay at home, monitor their symptoms and call tel:+1-877-644-4545 if they have a cough, https://www.quebec.ca/en/health/health-issues/a-z/general-information-about-coronavirus/#c46539 , difficulty breathing or sudden loss of sense of smell and taste without nasal congestion. These people must not go outside at all, even to go for a walk. Certain practices are also recommended if they live with other people who have not travelled. To obtain additional information on the procedures to follow, please https://www.quebec.ca/en/health/health-issues/a-z/general-information-about-coronavirus/#c53183 .
 ",I am returning from a trip. What do I have to do?,
2721199636,finalized,3,4/20/2020 21:40:05,"what laws were taken into account to protect staff who must be absent from work
Can my employer fire me if I have to isolate myself?
Can I be fired from my job?","The Gouvernement du Québec is asking employers to be understanding and flexible toward employees who are returning from travelling or who have symptoms.
 ",I work in the private sector and I have to self-isolate. Can my employer fire me?,
2721199637,finalized,3,4/20/2020 20:33:34,"What should I do if I am isolated?
What procedures should I follow if I need to self isolate
If i have the virus and want to protect other people,  what steps should i take to self isolate?","Individuals in voluntary self-isolation must stay at home, monitor their symptoms and call 1 877 644-4545 if they have a cough, https://www.quebec.ca/en/health/health-issues/a-z/general-information-about-coronavirus/#c46539 , difficulty breathing or sudden loss of sense of smell and taste without nasal congestion. These people must not go outside at all, even to go for a walk. Certain practices are also recommended if they live with other people who have not travelled. To obtain additional information on the procedures to follow, please https://www.quebec.ca/en/health/health-issues/a-z/general-information-about-coronavirus/#c53183 .
 ","If I must go into self-isolation, what instructions must I follow?",
2721199638,finalized,3,4/20/2020 22:05:07,"Is it necessary to return to my residence, despite being outside my country?
in the case of being out of my country as I return home?
What are the measures to be taken by people who are abroad?","The Gouvernement du Québec suggests that individuals who are abroad come home if possible.
 The Government of Canada in its https://travel.gc.ca/travelling/advisories?_ga=2.155976444.612942516.1584366966-332147478.1583942171 section recommends that individuals who are abroad find out about the commercial options avilable to them to return to Canada and to return sooner than planned if such options become more limited.
 ","If I am abroad, do I have to immediately come home?",
2721199639,finalized,3,4/20/2020 21:32:09,"Who is most at risk?
Which countries have the highest risk of a pandemic?
How do I get online or where do I get information about which countries are at higher risk of covid-19","For this information, you are advised to consult the https://travel.gc.ca/travelling/advisories?_ga=2.105850506.886082967.1584121752-1553186751.1579968697 section on the Government of Canada site.
 ",Which countries are most at risk?,
2721199640,finalized,3,4/20/2020 21:21:38,"If I have travel plans, should I cancel it because of the COVID-19 alert?
If i already have planned trips, can i just still go through or it's better to cancel them?
If I have travel plans, is it safe to cancel them due to the pandemic?","The Gouvernement du Québec is asking Quebecers to cancel non-essential trips.
 If you decide to travel anyway, you are advised to consult the https://travel.gc.ca/travelling/advisories?_ga=2.105850506.886082967.1584121752-1553186751.1579968697 section on the Government of Canada site. You must also self-isolate for 14 days when you return.
 ",I have travel plans. Should I cancel them?,
2721199641,finalized,3,4/20/2020 21:20:38,"What happens to truckers who are outside the borders and in an alert situation cannot enter?
Truck Drivers Will They Work?
What is the situation of the truck drivers in the border media?","Truck drivers and air crews and seagoing personnel do not have to self-isolate given the important role that they play in the transportation of critical goods such as food.
 ",What happens to truck drivers from outside our borders?,
2721199642,finalized,3,4/20/2020 21:31:03,"Will I be reimbursed what I already paid, if I have to cancel any project that already has payment?
If I cancel my trip, will I get a refund of my money?
Who should I talk to about the possibility of a refund if I have a planned trip?","There is currently no program to refund the cost of trips abroad. Travellers should contact their travel agent or travel insurer.
 ","If I have to cancel a trip abroad, will I be reimbursed for what I have already paid?",
2721199643,finalized,3,4/20/2020 22:16:46,"If I feel that I have coronavirus, what can I do?
What can I do to treat myself if I have symptoms of COVID-19?
If I have the virus, what steps should I take in the most appropriate way?","If you have symptoms of coronavirus disease, you will feel tired and weak. Rest will help you fight the disease. Limit your contact with other people until the symptoms have resolved. You can resume your activities when your condition allows.
 It is important to drink often because fever makes you sweat and lose a lot of fluids. At least 1.5 litres of fluids per day is recommended. Have hot or cold or drinks, whichever you prefer. Avoid alcoholic beverages or beverages that contain caffeine, such as coffee, tea and soft drinks. Alcohol and caffeine will make you urinate and increase fluid loss (dehydration).
 Watch for the following signs of dehydration:
 •  sensation of extreme thirst;
•  dry mouth and tongue;
•  infrequent or dark urine;
•  dizziness, confusion and headaches.
Complications of COVID-19 can develop a few days after symptoms first appear. If symptoms become more acute, you must go to the emergency room immediately or, if you need help, call 911. Watch for the following signs of a deterioration:
 •  body temperature over 38°C (100.4°F);
•  persistent or increasing difficulty breathing;
•  drowsiness, confusion, disorientation or difficulty staying awake;
•  no urine for 12 hours;
•  fever in a baby under 3 months of age.
",I have symptoms of coronavirus disease (COVID-19) or I have COVID-19. What can I do to take care of myself?,
2721199644,finalized,3,4/20/2020 21:48:13,"What can I do to protect people from hacking me if I have symptoms of COVID-19?
What are the steps to follow if I present the symptoms of covid -19 to protect my family
what should i do if i have symptoms?","To protect people around you, this is what you must do until your symptoms (fever, cough, fatigue, etc.) have resolved:
 •  Stay in a separate room to avoid contaminating your family;
•  Sleep and eat alone in your room;
•  Use a separate bathroom;
•  Cover your mouth and nose when you cough or sneeze, ideally with a tissue. Spit into a tissue. Wash your hands afterwards;
•  If you do not have a tissue, cough or sneeze into the crease of your elbow or upper arm;
•  Put used tissues into a garbage bag in a trash can with a lid. Keep used tissues out of reach of children;
•  Do not have visitors to your home.
Good hygiene and prevention practices are explained and illustrated in the https://cdn-contenu.quebec.ca/cdn-contenu/sante/documents/Problemes_de_sante/19-210-30A_Guide-auto-soins_anglais.pdf?1584985885 .
 ",I have symptoms of coronavirus disease (COVID-19) or I have COVID-19. What can I do to protect people around me?,
2721199645,finalized,3,4/20/2020 21:05:44,"How should I clean my environment on this moments of pandemic?
How should I clean
recommendations to clean my environment?","The virus that causes coronavirus disease (COVID-19) can live on objects and surfaces. It can survive for:
 •  3 hours on objects with dry surfaces;
•  6 days on objects with wet surfaces.
It is important to clean countertops, washbasins, door handles and any surfaces that are frequently touched by hands. Cleaning and disinfecting are very effective at eliminating the virus.
 •  For cleaning, use soap and water or household cleaning products.
•  For disinfecting, use a bleach solution or a disinfectant. A solution of 1 part bleach to 9 parts water is recommended, that is, 10 mL of bleach in 90 mL of water.
If you are sick, your bed linen, towels, clothes and dishes can be washed with those of other household members using regular detergent.
 ",How should I clean my environment?,
2721199646,finalized,3,4/20/2020 21:21:49,"What are the necessary cares for the sick?
steps to take to care for a person who has symptoms
What steps should be taken to care for a sick child or adult?","To find out how to care for a child or an older adult who is sick, refer to the Caring for sick children and Eldercare sections in the https://cdn-contenu.quebec.ca/cdn-contenu/sante/documents/Problemes_de_sante/19-210-30A_Guide-auto-soins_anglais.pdf?1584985885 .
 ",How should I care for a child or an older adult who is sick?,
2721199647,finalized,3,4/20/2020 21:05:28,"in case of presenting symptoms I must take some medicine
If I feel symptoms of coronavirus, what should I take?
If you have health problems, ask your pharmacist for advice or call Info-Santé 811 before taking non-prescription medications. Taking anti-inflammatory drugs may exacerbate coronavirus COVID-19","Over-the-counter medications can be used to relieve the symptoms of coronavirus disease (COVID-19). Before using, read the labels carefully and do not take more than the recommended dose. You are strongly advised to ask your pharmacist for advice before using over-the-counter medications if you have symptoms. Do not take products that contain the same ingredients at the same time, such as Tylenol® and Tylenol® Sinus. If you have health problems, ask your pharmacist for advice or call Info-Santé 811 before taking over-the-counter medications.
 Taking anti-inflammatories may make coronavirus disease (COVID-19) worse, but this information is based on clinical observations and has not been confirmed or disproven. According to some recommendations, ibuprofen should not be taken by people who have COVID-19 to relieve fever. Advil® and Motrin® belong to this drug class. If you are already taking anti-inflammatories and you test positive for COVID-19, speak to your pharmacist , doctor or specialized nurse practitioner.
 ",What medications should I take to relieve my symptoms?,
2721199648,finalized,3,4/20/2020 21:25:46,"What treatment should be performed in case of fever?
Tips for remedying a fever?
What is the normal temperature that I should have?","Fever is a defence mechanisms that helps fight infection. Acetaminophen is recommended for the relief of fever and discomfort, unless you are advised otherwise by a health professional or are allergic to this medication.
 Fever is defined as follows:
 •  In children: 38°C (100.4°F) or higher (rectal T°);
•  In adults: 38°C (100.4°F) or higher (oral T°);
•  elderly person 37.8°C (98.6°F) or higher (oral T°);
or
 •  an increase of 1.1°C above a person’s usual value.
",What can I do to relieve a fever?,
2721199649,finalized,3,4/20/2020 21:19:24,"Tips for pain in my throat?
What can of water do i have to use in order to relieve my sore throat?
What do you recommend for a sore throat?","Gargle with a glass of salt water: 2.5 mL (1/2 tsp.) of salt in 250 mL (1 cup) of lukewarm water (do not swallow the solution). Hard candy or lozenges, preferably sugar free, can also relieve your sore throat.
 ",What can I do to relieve a sore throat?,
2721199650,finalized,3,4/20/2020 20:48:05,"How we can ask for help?
Where can i get information on the help i could possibly need?
Help me?","If you are worried, do not hesitate to ask for or accept help. It is important to talk about it with your family and friends.
 For home care, you can also call 211 or ask your CLSC to connect you with home care services.
 For food assistance , visit the https://www.banquesalimentaires.org/en/ website.
 For information about financial support for individuals, visit the https://www.canada.ca/en/department-finance/economic-response-plan.html .
 For information about other support measures, go to the https://www.quebec.ca/en/health/health-issues/a-z/2019-coronavirus/ page.
 ",How can I ask for help?,
2721199651,finalized,3,4/20/2020 21:02:50,"What are the risk effects and who do they affect after covid-19?
Who the rang of people that could get complicate after contracting Covid-19?
are the young people in risk if they get sick of covid-19?","The risk of serious complications for people with COVID-19 increases with age, but even young adults are at risk. The risk of dying from serious respiratory complications (pneumonia or acute respiratory distress syndrome) due to COVID-19 is especially high in:
 •  people age 70 and older;
•  people who have a weakened immune system;
•  people who have a chronic disease; such as: •    heart disease;  
•    lung disease;  
•    kidney disease.  

",Who is at risk of complications after contracting COVID-19?,
2721199652,finalized,3,4/20/2020 21:18:37,"how the caregiver of a person who was confined in a hospital due to covid-19 was identified. and for how long are you in this care center
If I am sick of something other than Covid-19, can I go to the hospital?
Are visits to health centers and various care centers for the elderly allowed?","Starting March 13, 2020, non-essential visits to hospitals, residential and long-term care centres, intermediate resources, targeted family-type resources and private seniors’ homes will be prohibited to protect the most vulnerable individuals and workers in the health and social services network. In the case of births, the other parent, significant other or natural caregiver identified for this purpose is not deemed to be a visitor and can accompany the mother.
 In cases where the end of life is imminent, the constant presence of one or two people who are of significant importance to the person is not deemed to be a visit.
 ","Are visits permitted to hospitals, residential and long-term care centres, intermediate resources and family-type resources for the elderly and vulnerable adults and private seniors’ homes?",
2721199653,finalized,3,4/20/2020 21:02:50,"Can I help with food in hospitals, rest homes and shelters for people who are vulnerable during quarantine?
What about to delivery at hospital or risk zone?
what are the procedures to deliver food to hospitals, residential and long-term care centres?","It is possible to deliver food to seniors’ homes. Avoid all contact with the residents and leave immediately after giving the food to a staff member at the reception desk.
 At all times, it is important to keep distance between people, avoid direct contacts and follow the usual hygiene rules when you cough or sneeze.
 To limit the possibility of introducing the coronavirus into hospitals, residential and long-term care centre and family-type intermediate resources for seniors and vulnerable adults, the delivery of food from outside (delivery by a restaurant, food brought by family members) is prohibited.
 ","Is is possible to deliver food to people in hospitals, residential and long-term care centres, intermediate family-type resources for seniors and vulnerable adults and private seniors’ homes?",
2721199654,finalized,3,4/20/2020 21:40:05,"Could one way or another help the most vulnerable sectors?
Is it possible to deliver essential products to people who are in quarantine in all the places they cannot leave?
it is possible to help hospitalized people, elderly in nursing homes or other people who are in need, with essential products and articles","If the users require certain items that the hospitals, residential and long-term care centres, and family-type intermediate resources for seniors and vulnerable adults do not offer, it is possible to deliver them. A security mechanism for their delivery must be established to avoid any contact with the residents. Leave immediately after giving the food or items to a staff member at the reception desk.
 At all times, it is important to keep distance between people, avoid direct contacts and follow the usual hygiene rules when you cough or sneeze.
 ","Is is it possible to deliver essential items to people in hospitals, residential and long-term care centres, intermediate family-type resources for seniors and vulnerable adults and private seniors’ homes?",
2721199655,finalized,3,4/20/2020 21:30:33,"is visiting a loved one in the hospital prohibited?
Is it possible to go to a hospital to visit a sick person who is about to die as a relative?
Could you visit a loved one infected with covid-19?","Yes. Health care establishments tolerate visits under exceptional or humanitarian circumstances.
 The Gouvernement du Québec is prohibiting non-essential visits.
 ",Can an individual go to a hospital to visit a loved one who is dying?,
2721199656,finalized,3,4/20/2020 20:30:22,"Can the residents of residential and long-term care centres, family-type intermediate resources for seniors and vulnerable adults and in private seniors' homes leave the facilities for medical appointments on pandemic?
Can elderly people, animals and people in care leave the facility?
Can an elderly person in institutions of care for his age, or vulnerable people, leave their care site to take treatment elsewhere during the quarantine?","These people are asked to stay in their living environment, except where necessary or under exceptional circumstances, such as an essential medical appointment. They must be supervised.
 When they return to their living environment, all preventive and infection control measures must be applied in an exemplary manner, for example, frequent handwashing with warm running water and soap for at least 20 seconds or an alcohol-based disinfectant. It is also important to cover the mouth and nose with the arm to reduce the spread of germs when coughing or sneezing. When using a disposable paper tissue, discard it promptly and then wash your hands and avoid direct contact such as handshakes when greeting others.
 These exceptional measures seek to contain COVID-19’s spread.
 ","Can the residents of residential and long-term care centres, family-type intermediate resources for seniors and vulnerable adults and in private seniors' homes leave the facilities for medical appointments?",
2721199657,finalized,3,4/20/2020 20:42:39,"Can we deliver meals to vulnerable elderly people who live alone at home during this time?
Can I deliver some essential foods or items to older people in my home?
Would it be possible to deliver food and medicine to elderly people who are in their homes?","It is possible to deliver groceries to elderly people or people with a weak immune system solely if you do not display any symptoms and have not returned from a trip within less than 14 days.
 It is important at all times to maintain distance between individuals, avoid direct contacts and abide by the usual rules of hygiene when you cough or sneeze.
 ",Is it possible to deliver food or essential items to elderly people living at home?,
2721199658,finalized,3,4/20/2020 21:17:33,"Given this pandemic situation, what risk do pregnant women run?
Are pregnant women at risk?
Can a pregnant woman with coronavirus infectious the fetus?","According to the World Health Organization, pregnant women are at no greater risk than adults in general of complications related to COVID-19. Scientists note that there is no known risk of malformation or mother-to-foetus transmission. The usual preventive rules apply to pregnant women. For more information, see the https://www.quebec.ca/en/health/health-issues/a-z/2019-coronavirus/information-for-pregnant-women-coronavirus-covid-19/ page.
 ",Are pregnant women at risk?,
2721199659,finalized,3,4/20/2020 21:20:38,"Are younger children less at risk of COVID-19 infection?
What is the risk of contracting the disease according to age?
infants have less risk?","Yes, children are less at risk. However, they can still transmit the virus. Consequently, directives aimed at containing the virus’ spread also apply to children. For more information, see the https://www.quebec.ca/en/health/health-issues/a-z/2019-coronavirus/information-for-parents-of-children-age-0-to-17-coronavirus-covid-19/ page.
 ",Are children less at risk?,
2721199660,finalized,3,4/20/2020 21:20:38,"How can I keep in touch with everyone I meet during the COVID-19 alert?
Can I make calls to my relatives during the emergency?
What can I do to keep in touch with my family during the emergency situation?","Distance socializing strategies, such as using alternative ways of communicating, can help you stay connected and even become closer to family and friends.
 Don’t minimize the positive effects of distance socializing, since continuing to socialize has a positive impact on your physical and psychological health at every stage of life.
 For example, you can use direct or indirect means of communication or even get creative:
 •  Direct: phone calls, video chats, text messages, social networks, digital apps (WhatsApp, Skype, etc.) or other technologies.
•  Indirect: prerecorded voice messages or videos, letters, postcards, digital photos.
•  Creative: drawings, crafts, photo collages, a recording of yourself reading a children’s story, arrange a time to say hello from your balcony or the street, dinner for two by Skype.
To get the most out of your experience, find out which means of communication you and your family and friends like best and decide how often you will use them.
 ","How can I stay in touch with family and friends, wherever they are, during physical distancing and the fight against the pandemic?",
