_unit_id,_unit_state,_trusted_judgments,_last_judgment_at,write_a_coherent_question_that_would_result_in_the_answer_shown_above_do_not_copy_the_sample_question_,answers,questions,write_a_coherent_question_that_would_result_in_the_answer_shown_above_do_not_copy_the_sample_question__gold
2721199759,finalized,3,4/20/2020 21:21:38,"Can parents or students go to schools to look for their belongings?
What if my child need any education 0essential  or personal objects, can i go to the school to pick it or will be problems if so?
Can students return to schools to search for personal items?","Until further notice and in accordance with the new guidelines issued by public health authorities, students and parents will not be able to return to school to pick up their personal effects.
 ",Can students and parents return to school to pick up their essential personal effects?,
2721199760,finalized,3,4/20/2020 22:05:07,"Will the rental of rooms and other infrastructure remain?
will the leases be affected?
real estate rentals are prohibited due to this health emergency?","As schools are closed, infrastructure sharing will be temporarily interrupted in order to slow the spread of the virus from a public health perspective. As these institutions are closed, related activities such as room rentals and sports and cultural activities are also suspended.
 ",Are room rental and infrastructure sharing agreements maintained?,
2721199761,finalized,3,4/20/2020 20:42:39,"Will any action be taken upon returning to normal activities?
Is it possible that appropriate measures will be taken against covid 19 with the return of students and staff to the educational areas?
What will happen to students when they return to educational institutions? will be measured by the covid?","The premises will be subject to regular, appropriate maintenance to ensure their cleanliness. Efforts will be made to raise awareness about proper hand washing and respiratory hygiene. Complementary measures may be put in place in the future.
 ",Will specific measures be taken when students and personnel return to educational institutions?,
2721199762,finalized,3,4/20/2020 21:48:56,"Will the emergency daycare services continue to operate?
The nurseries are allowed to perform their services in these weeks?
Yeah, Emergency school daycare services will be ready to accommodate a large number of children","Yes. Emergency school daycare services will be able to receive a considerable number of children.
 ",Do emergency daycare services have the necessary capacity to continue their services for additional weeks?,
2721199763,finalized,3,4/20/2020 21:25:46,"Should school grouping be prohibited?
Is it mandatory to distance yourself if you see several groups in a school?
what are the guidelines that the government gave to avoid contagion","Yes, we urge you to respect government guidelines regarding physical distancing.
 ",Must physical distancing measures be implemented if there are several groups in the same school?,
2721199764,finalized,3,4/20/2020 22:12:18,"Will children have access to educational services during quarantine?
What services do daycare centers have in these times of global emergency?
Will children who attend daycare have access to educational services?","They will have access to the same tools that will be made available to parents and students. However, the use of these tools remains optional, not compulsory.
 ",Will children who attend the emergency daycare centres have access to educational services?,
2721199765,finalized,3,4/20/2020 21:57:16,"How do I know if my child qualifies for emergency care or not?
Educational child care services during this emergency situation should qualify the most suitable children for the position?
What group of children is the health services for in this health emergency?","The emergency childcare services currently available are a solution of last resort. Family members, friends, neighbours or young people not in school can babysit children at home to help out healthcare workers and essential services workers, provided that there are only a few children and that, above all, the sitters comply with the sanitary instructions and hygiene rules issued by the Québec government.
 This service is available only to parents whose job is included in the list of https://www.quebec.ca/en/family-and-support-for-individuals/emergency-daycare-services/list-jobs-and-essential-services/ .
 ",What children qualify for educational childcare services during the emergency situation?,
2721199766,finalized,3,4/20/2020 21:21:38,"How can parents find an educational center for children, on the alert?
What are the steps to do a succesful educational childcare in home, what are the resources to take meanwhile the emergency situation last?
How and where can parents find a child care educational setting during the COVID-19 emergency situation?","Parents can use the https://geoegl.msp.gouv.qc.ca/mfa/recherche-proximite.php?langue=en and then contact the day care of their choice directly. They can also contact the Ministère de la Famille if necessary at: 1-855-336-8568.
 ",How can parents find an educational childcare centre during the emergency situation?,
2721199767,finalized,3,4/20/2020 20:33:34,"How can I find a daycare center that offers emergency services?
I need to find alternative day care for my child. How do I do this
How can i find a day care for my children?","Parents can use the https://geoegl.msp.gouv.qc.ca/mfa/recherche-proximite.php?langue=en and then contact the day care of their choice directly. They can also contact the Ministère de la Famille if necessary at: 1-855-336-8568.
 ",My non-subsidized day care is no longer offering emergency services; how can I find another day care?,
2721199768,finalized,3,4/20/2020 21:43:56,"The center realizes specific information about a child's health, diet, or how to reach the emergency contact. If the document cannot be printed, parents must note the information on paper and provide it for daycare upon arrival. Sign the protocol they will give regarding acetaminophen given in case of fever.
What would be the page where parents can print the form to register their child in a child care educational center?
Sign the protocol they will give regarding acetaminophen given in case of fever. Although the signing of the protocol is not mandatory, Ministère strongly encourages this in the current situation to ensure the health and well-being of children as possible. Complete the Emergency Child Care Services Agreement; sign their child's attendance record every four weeks.","Parents are to call the day care centre they have chosen directly, without going through the single-window access to childcare services (La Place 0-5). They will be asked at that time about their child’s specific needs, such as allergies, physical disabilities or developmental delay.
 The childcare centre that accepts their child will ask the parents:
 •  To complete the  https://www.quebec.ca/en/family-and-support-for-individuals/emergency-daycare-services/  and print it so that the centre is aware of specific information about the child’s health or diet or how to reach the emergency contact. If the document cannot be printed, the parents must write down the information on a sheet of paper and give it to the day care on their arrival.
•  Sign the protocol they will be given concerning the administering of acetaminophen in case of fever. Although signing the protocol is not mandatory, the Ministère strongly encourages this in the current situation to ensure the health and well-being of the children as much as possible.
•  Complete the emergency childcare services agreement;
•  Sign their child’s attendance sheet every four weeks, which shows the dates and days or half-days that the child attended or was absent from the day care.
",How can parents register their child at an educational childcare centre during the emergency situation?,
2721199769,finalized,3,4/20/2020 21:54:10,"Is it necessary for all of us to present proof of this?
Do people with a list of Workers who are entitled to emergency child care services have to provide proof of this to their daycare?
Do people who are recieving emergency childcare services  have to provide proof of this to their day care?","Yes. They must show their employee card (proof of status) or any other relevant document (e.g. pay stub).
 ",Do people with a job on the list of Workers who are entitled to emergency childcare services have to provide proof of this to their day care?,
2721199770,finalized,3,4/20/2020 21:20:38,"Can school-age children be accepted into an educational institution in an emergency situation?
What is the age of the children who will be accepted for special care during the emergency?
Can children be accepted while the emergency situation lasts?","If the parents so request, emergency childcare services are asked to bring siblings together as much as possible. This is a public health recommendation aimed at avoiding multiple contacts and curtailing travel for essential services workers.
 ",Can school-age children be accepted at an educational childcare centre during the emergency situation?,
2721199771,finalized,3,4/20/2020 20:49:50,"Will the cost of childcare be waived or not?
Does this imply 100% of the payment for educational services? and how long will this payment be?
Should I pay for my child's care even if I don't attend?","Emergency childcare will be continued to be provided free of charge. Therefore, parents will not have to pay for it. Their contribution will be paid by the government of Quebec.
 ",Will parents who use educational childcare services during the emergency situation have to pay the cost of childcare?,
2721199772,finalized,3,4/20/2020 22:04:05,"should parents pay for all of their services during the pandemic?
Why don't parents whose children go to unsubsidized schools have to pay?
Do parents have to pay for educational child care services during the emergency situation?","No. Parents with children who attend a non-subsidized day care centre will not have to pay for the cost of childcare during this period.
 ",Will parents who can no longer use educational childcare services during the emergency situation have to pay for these services?,
2721199773,finalized,3,4/20/2020 21:20:56,"Could it be safe or not allowed to take care of children of friends during the alert state?
What are the conditions in order to babysit children of my friends or family?
What steps should I take with children and family close to my area in this crisis?","We remind you that you are advised to limit your movements as much as possible and that anyone who is not providing an essential service should stay at home. However, if someone needs a babysitter for their children and does not have access to emergency day care, you may do so. The following conditions apply:
 •  no one has fever, cough, difficulty breathing or sudden loss of sense of smell and taste without nasal congestion.
•  no one has been told to self-isolate,
•  no one in the home is at risk (e.g., chronically ill or 70 years of age or older).
As far as possible, physical contact between children must be limited and they must be kept 2 metres apart. Regularly clean and disinfect high-touch surfaces and items, such as door handles, light switches, faucet handles, etc. Clean bathrooms more frequently. Clean toys frequently, especially toys that children might put in their mouth. Follow the https://www.quebec.ca/en/health/health-issues/a-z/general-information-about-coronavirus/#c53183 .
 ",Is it safe or are we allowed to babysit the children of friends or relatives to help them out?,
2721199774,finalized,3,4/20/2020 21:10:14,"Since what time will the educational centers work during the emergency?
Faced with this quarantine situation, can we go to emergency child care services if we need them?
Will the child care places be operating normally?","Emergency childcare services will maintain their usual hours of operation.
 ",What hours will educational childcare centres be open during the emergency situation?,
2721199775,finalized,3,4/20/2020 20:40:33,"Will educational childcare centres provide meals and snacks to the children?
Educational zones must continue to provide all services?
they should continue to provide their usual services and not stop.","Yes, they must continue to provide their usual services.
 ",Will educational childcare centres provide meals and snacks?,
2721199776,finalized,3,4/20/2020 22:19:15,"The government will give subsidies?
Unsupported day care centers are entitled to financial assistance to cover their basic fixed costs.
Unsupported day care centers are entitled to financial assistance to cover their basic fixed costs, which will be paid soon","Non-subsidized day care centres will be entitled to financial aid to cover their basic fixed costs, which will be paid up to May 1, 2020.
 ",The government of Quebec said that financial compensation would be paid to non-subsidized day cares. What does this compensation cover?,
2721199777,finalized,3,4/20/2020 20:48:05,"Can an educatinal childcare refuse a child?
Are childcare centres obligated to accept any child?
¿Es posible que nieguen a un niño las guarderías?","Yes, educational childcare centres must refuse:
 •  children whose parents do not have a job on the list of  https://www.quebec.ca/en/family-and-support-for-individuals/emergency-daycare-services/list-jobs-and-essential-services/  , except for children of educational childcare personnel
•  children who must be in isolation following public health directives
",Can an educational childcare centre refuse to accept a child?,
2721199778,finalized,3,4/20/2020 22:17:08,"¿What would be the protocol to follow if a child has symptoms for the virus COVID-19?
What guidelines exist for cases involving children in school and or child care settings?
What would happen if my children got infected by coronavirus?","Educational childcare services must follow https://www.mfa.gouv.qc.ca/fr/publication/Documents/feuillet_SGDU-ang.pdf . For more information, call tel:18776444545 .
 ",What should an educational childcare centre do if a child appears to exhibit symptoms of COVID-19?,
2721199779,finalized,3,4/20/2020 20:48:05,"How many children can accommodate a fundation?
How will the day cares and childcare centers (CPEs) be affected regarding the social distancing mandated by the public health department?
What is the capacity of a nursery?","Based on public health directives, day cares and childcare centres (CPEs) cannot accept more than 30% of the number of children registered under their licence or, in the case of a home childcare provider (HCP), not more than 30% of the number of children that can be accepted under the provider’s recognition as an HCP. Nor can any day care services exceed 50% of the usual number of children per educator.
 The government assures the public that the childcare services that continue to be provided comply with the pandemic standards imposed. Our priority is always the health and safety of children and childcare personnel.
 ",How many children can a day care accommodate?,
2721199780,finalized,3,4/20/2020 21:43:56,"Ensure that sick children are not admitted to day care homes and request strict parental cooperation in this regard. They should isolate the sick child from other children and ask the parents to come and accompany the child as soon as possible.
What would be the protocol that educators should apply in an emergency?
Ensure that sick children are not admitted to day care homes and request strict parental cooperation in this regard. They should isolate the sick child from other children and ask the parents to come and accompany the child as soon as possible.","Educators must apply the infection control protocols they already use during respiratory infection season. Therefore:
 •  They must ensure that sick children are not admitted into the day care and call upon the parents’ strict cooperation in this matter.
•  They must isolate a sick child from other children and ask the parents to come and pick up the child as soon as possible.
Refer to the following documents for more information:
 •  https://www.mfa.gouv.qc.ca/fr/publication/Documents/feuillet_SGDU-ang.pdf 
•  https://www.mfa.gouv.qc.ca/fr/publication/Documents/Document-Protocole_22-mars-2020.pdf  (French only)
",What are the appropriate public health directives in this emergency situation?,
2721199781,finalized,3,4/20/2020 21:15:04,"What are the commons procedures to do if a child if showns any symptoms?
What are the main symptoms of Covid 19 in a child and what measures should be taken if they occur?
What can you do if an infant has symptoms?","Refer to the https://www.mfa.gouv.qc.ca/fr/publication/Documents/feuillet_SGDU-ang.pdf .
 ",What do you do if a child exhibits symptoms?,
2721199782,finalized,3,4/20/2020 21:16:50,"What website can I visit if an educator is infected?
What can I do if an educator has symptoms, what will be my steps to accomplish in this situation?
What should a person do when presenting their first symptoms?","Refer to the https://www.mfa.gouv.qc.ca/fr/publication/Documents/feuillet_SGDU-ang.pdf .
 ",What do you do if an educator exhibits symptoms?,
2721199783,finalized,3,4/20/2020 20:45:31,"Where do I have to call if there is a case of COVID-19 in a kindergarten?
What should the public branch do when detecting a child with covid 19 in a kindergarten?
What happens if there is a case of covid-19 in the daily care home, what measures should we be taking?","If a child who attended the day care tests positive for COVID-19, the first thing to do is to call your public health regional branch (if it has not already contacted you). The public health regional branch will investigate and take the necessary measures to evaluate and take charge of each of the sick child’s contacts (staff, children and close family).
 ","If there is a case of COVID-19 at a day care, what should be done?",
2721199784,finalized,3,4/20/2020 21:49:28,"Do all child care staff need to do their job in this situation?
Do all pediatric care staff need to work in this quarantine?
Are the personnel dedicated to the childcare require to still working even when it's there a official emergency situacion?","Childcare administrators can take into consideration the number of children present to adjust the number of staff members required. They can release some staff, plan rotations and recall lists, or assign their staff to other useful tasks pending a return to normal.
 ",Are all childcare personnel required to work in this emergency situation?,
2721199785,finalized,3,4/20/2020 21:18:37,"Through what medium will students be given indications on the new study method adopted by the pandemic emergency?
until when will the institutions be closed?
What are the educational institutions that will remain closed?","CEGEPs, colleges and universities are closed until May 1, inclusive.
 In the case of colleges and universities, this measure targets both students and personnel, who must continue to consult all instructions sent to them by their institution. Specifically, from March 14 through May 1, all unnecessary and non-essential teaching and research activities are suspended in universities, CEGEPs and colleges.
 It is the responsibility of administrators to make the decisions regarding these activities as well as any others related, in particular, to necessary and essential services so as to restrict to a minimum any physical presence in the institutions and on the campuses. Working from home should be encouraged.
 Related activities such as room rentals and sports and cultural activities are also suspended. Administrative personnel must continue to work. Alternative solutions such as teleworking are encouraged, whenever possible.
 ",Which institutions are closed or open?,
2721199786,finalized,3,4/20/2020 21:51:27,"Are student internships to be postponed?
How are the internships of the universities handled?
Can students be penalized if they can't continue their work remotely during postponed internships?"," For higher education If internship settings have confirmed the continuation of the internship, the students’ workplace respects the instructions issued by the public health agency, and the students are able to carry out their work (e.g. from home or elsewhere), then internships are possible. However, students cannot be penalized for their inability to meet requirements.
 ",Should students’ internships be postponed?,
2721199787,finalized,3,4/20/2020 21:24:33,"Could you tell me what is the meaning of teaching and research activities?
What are the activities that we can continue with in order to guarantee the provision of the organization's primary services?
Will the teaching activities continue to be applied in educational institutions?","Some teaching activities in health care-related programs could be maintained in order to ensure the ongoing provision of care services (e.g. nursing internships, clerk and resident rotations). Teaching activities such as grading exams can also continue to be done remotely.
 In terms of research activities, each educational institution is responsible for defining the scope of necessary and essential activities. For example, research activities involving personnel and equipment that could potentially assist or lend support to health care services could be maintained. Necessary or essential research activities could also include projects involving animal care, plant care or cell culture projects.
 ","What does ""some teaching and research activities"" mean?",
2721199788,finalized,3,4/20/2020 22:14:36,"Can the students be penalized for not meeting the requirements to pass the class?
Can teachers continue to assign work even if there is no  access to laboratories or to materials available only on campus?
Will the students do their home activities as dictated by the teachers?","Colleges are responsible for teaching and for evaluating learning activities. In no case should students be penalized because, during this period, they cannot meet expectations or adjust to changes in pedagogical methods.
 ","Can teachers continue to assign work, particularly if access to laboratories or to materials available only on campus is required in order to do an assignment?",
2721199789,finalized,3,4/20/2020 21:25:46,"Will student tuition money be refunded?
Will school refunds be issued?
Is the money paid to the institutes reimbursed?","For now, the school year has not been cancelled. It is therefore too soon to say.
 Keep in mind that, based on the current situation, the measures taken by the government concerning the suspension of activities in the education and higher education systems extend up to May 1. We will be closely following the situation and will keep you informed of any new guidelines.
 ","Will tuition fees be reimbursed for the period during which students are not in school (ACS, private colleges)?",
2721199790,finalized,3,4/20/2020 21:21:49,"Can I be penalized if I cannot attend my internships?
should internship studies be postponed?
the internships should be postponed?","If internship settings have confirmed the continuation of the internship and the students’ workplace respects the instructions issued by the public health agency, then internships are possible. However, students cannot be penalized for their inability to meet requirements.
 ",Should internships be postponed?,
2721199791,finalized,3,4/20/2020 21:37:20,"What will happen to students who are taking internships?
Are there any solutions yet as to how to continue student's educations?
what does the government do to find solutions regarding the situation of education students?","Government is working with the Association des doyens, doyennes et directeurs, directrices pour l’étude et la recherche en éducation au Québec (ADÉREQ) to find solutions regarding the situation of education students.
 ",What will happen to the internships of students in education?,
2721199792,finalized,3,4/20/2020 21:59:17,"What planes are there for students who are close to graduating from college?
In my college everything is online now, what are the going to do considering practical lessons that requires students attendance?!
Will there be any plans in place for students hoping to graduate from college?","It is up to each institution to establish learning and evaluation procedures it considers appropriate in order to ensure that students develop the competencies required to complete their program of study and to graduate. Students should not be penalized for their inability to complete their program through alternative means developed by their institution.
 ",Are there any plans in place regarding students who expect to graduate from college or university?,
2721199793,finalized,3,4/20/2020 20:41:58,"open changes in student financial payments with this country situation?
What adjustments will be made to the student financial assistance program in response to the COVID-19 crisis?
Does this crisis have a negative impact on student financing?","For the moment, the student financial assistance program has not been modified. Payments will continue to be issued.
 ",What adjustments will be made to the student financial assistance program in response to the crisis?,
