,question,ahc_label
1217,What's happen for country near the Ecuador with a lot of hot? ,0
342,What is the advice surrounding outdoor exercise/sport?,0
348,Will NHS workers be even more isolated because they are exposed to the virus on a daily basis?,0
586,Will the virus affect my sexual ability ,0
1265,"I was in contact with a person who had coronavirus, what should I do? ",0
1264,"What measures can I take, if someone I know is effected with the virus",0
1263,Can I fo,0
1260,Do I need to be seen by a doctor,0
1266,What is your name,0
583,My sister-in-law is pregnant and lives in a house with extended family where one member is isolated due to possible contact with someone with COVID-19. Are the risks for pregnant woman Higher? How can she protect?,0
901,"Hello, I am social distancing and taking precautions, however I have to share a communal sink. I try to stay as safe as possible by cleaning it, but I have touched the knobs with my bare hands without thinking, can germs spread this way? Should I avoid the sink in general? Thank you! ",0
578,what is canada quarantine policy?,0
366,"How long could the virus stay alive on doorknobs, traffic signal buttons, stair rails?",0
683,I need to take a blood test. Is there a large risk for infection?,0
905,I have Hashimoto's hypothyroiditis. Am I more at risk? I also had a PE due to Fv-leiden and oral contraceptives in 2001...what do you recommend I do?,0
1203,Should I use asprin with I have the coronavirus?,0
1202,How are you?,0
1248,"im sneezing, should i be worried?",0
1197,"What are the demographics of people infected, hospitalized and deceased in Quebec, ",0
339,How often should i take my temperature?,0
895,Do I need to stay away from my family members if we're all social distancing together in the house?,0
1434,When will the municipalities post heat maps to identify hot spots for Covid positive residents?,0
985,"I'm hot, what do I do?",0
298,"In the U.S., why has the Defense Production Act not been invoked to allow weekly (?) testing of every single person present in The United States?  Yes, this is on the scale of industrialization of the WW2 era, and yes, that is *exactly* what the Defense Production Act is for.",0
865,who needs to be isolated?,0
1394,I have a headache for the past 3 days should I be tested ? ,0
1366,My son is flying from Kansas to England on the 30th April. He is flying into Heathrow and then travelling home to Manchester by train,0
306,why is my dick so big,0
589,What have you implemented to help older people who do not know how to use the internet/phone to obtain their groceries and medicine?,0
608,what is this site,0
1339,How do i knew if i got covid,0
1336,"What is the difference between a pandemic & epidemic? Why did WHO declare this a pandemic? What is the difference between social distancing, self-isolating and quarantine? To what extent is social distancing helpful? Why should I do this? When should you self-isolate? Will the virus be less effective when we get warmer weather?  When should I go to the hospital? Should I get tested if I was in contact with someone who has or is suspected of having covid19 (but do not have any symptoms)? Should I stop taking medications that suppress my immune system?  When someone in the household is coming and going (for work), how can we keep the home a safe place? Can the virus be transmitted through Air Conditioning? (from outside or from within the home) How long does the virus last on inanimate objects (plastic, glass, cardboard, metal)? What have we learned from countries like China, South Korea and Singapore that have been dealing with this for a longer period of time and have slowed the spread?",0
883,"If there are kids around me, do I have to worry if they are infected and I do not know?",0
1312,Would using heated-vapor humidifier help with sanitizing the sinuses of the covid-19?,0
1309,How long has the virus been spreading in Canada?,0
888,Isn't the economy impact (and the panic reaction) going to kill more than the virus? It seems the virus only kills 1%... while over 30% of the population might lose their jobs.,0
1284,Can I go out after recovery even if I am still in quarantine time?,0
868,Should I not touch my mail?,0
1191,WHat is your name,0
907,What are effective immunity boosters?,0
1166,Do I need to wash my vegetables and fruits?,0
555,Does taking high doses of vitamin C and D help fighting the disease? As an immune system booster! Is there any study on that?,0
1050,what is pandemic,0
479,Does Quebec Health Public System have the capacity to fight this COVID-19 outbreak ?,0
1048,How much it's prevelent in Pakistan?,0
553,How does COVID-19 affect lungs? And how do you see this pandemic will impact the world's economy?,0
1038,What is the half-life of coronavirus?,0
494,When will be done?,0
1069,I am in self isolation.   Is it ok to let in family members who must continue to go to work?,0
495,Does temperature has any effect on the virus,0
1026,How many days should I isolate for,0
512,Why is Trudeau asleep?,0
946,Does everyone infected need a respirator?,0
951,Is it safe to give blood?,0
1000,How fast will the pandemic spread in Canada?,0
525,Is ACE Inhibitor harmful ,0
999,Should I be worried about getting sick if the government does not lock down everything?,0
547,Will 1 meter distancing safe?,0
1073,what is the risk for a pregnent woman ?,0
1079,When will life get back to normal?,0
1085,Will the pandemic affect university research?,0
1147,I recently relocated to Quebec. Can I request RAMQ card with visiting the RAMQ office?,0
1143,When will we be back to work?,0
909,What is the current COVID-19 confirmed cases trend for Canada?,0
417,When should I visit a doctor?,0
419,"Would it help eradicate viruses immediately if we put in place proper healthcare systems throughout every country, rich or poor, and to also have enough health professionals worldwide in place who will immediately recognize if there is a contagious virus in their city to eradicate it before it spreads?",0
1122,"Would it help to ensure there is a warehouse already filled with protective gear for health professionals worldwide, instead of scrambling, or ordering these last minute, and also have enough hospitals built, because if we don't do that, we'll have to do what China did and build a hospital at the last minute?",0
422,Is it safe for seniors to go out for a walk or inside shopping malls which are quite isolated these days?,0
428,Can COVID-19 stay alive on fresh fruit and vegetables?,0
429,"Hello, what happens after corona?",0
912,When should I contact a doctor?,0
432,I worry for my mental health during quarantine,0
564,Will there be any changes in PGWP?,0
917,Were there documented cases before January 2020?,0
449,When will the schools reopen?,0
926,How should I keep my family safe during covid-19?,0
456,Is it true that you can get the virus again even after you've recovered ,0
1090,Can you get the virus twice ? ,0
854,What precautions should I take with things delivered at home?,0
1449,Have there been any deceased children so far?,0
1400,Is it possible to be infected again?,0
282,Should I star home and even avoid going to the supermarket and drugstore?,0
663,how are you,0
123,Do we see a future where this virus won't be such a threat anymore? ,0
1711,How many days does it take to see the symptoms,0
136,Non,0
1696,"If I was traveling abroad recently, what should I do when coming back home?",0
149,what are the syptoms?,0
154,How many infected person in south korea?,0
111,What is,0
1686,how much fever should i tolerate before going to the doctor? ,0
1649,What's the capital of Palestine?,0
744,Is it safe to get a new job that deals with the public?,0
1645,Can I still go out for grocery shopping even if I'm just getting back from vacations,0
165,Are there still flights within Canada?,0
1641,How many will lose their jobs due to the chinese virus?,0
1451,Should I use Sudafed?,0
789,Has the virus evolved,0
742,Should I take the metro?,0
797,How do we best organize people so that duplicate work is not being done?,0
1722,I have asthma. How at risk am I about the possibility of complications?,0
48,South korea,0
1847,Is the phlegm color suggestive of coronavirus? ,0
1831,should I worry about covid 19?,0
7,What are the synthoms?,0
1817,how painful will it be if I got the virus?,0
1812,How to stay safe,0
702,Will it get better in summer with higher temperatures?,0
14,covid19 symptons?,0
1739,How much the quarantine process has a positive impact on reducing contamination spread?,0
1788,could we have done better?,0
19,How to avoid exposure?,0
1787,what is this rainbow thing that people are talking about,0
1779,"should I call to find out more, it’s the coughing and difficulty breathing and fatigue that worries me",0
1775,Can I move in with family if we have all been symptom free for 14 days?,0
669,Can you explain to me what is the covid19?,0
716,Hypertension ,0
1741,What should you do if you dont have water and soap and sanitizer?,0
18,What is it,0
179,Precautions to measure? ,0
994,how long would it take for the virus to disappear ? ,0
1555,How are you ,0
625,Are there any federal or provincial services to help senior citizens get grocery safely?,0
627,How long do we need social distanciation for the virus to be less of a threat? ,0
824,Where did COVID-19 come from?,0
1546,Does washing clothes in the  washing machine prevent transmission ? ,0
240,Where can we find ventilator?,0
1548,What are the confirmed symptoms of COVID19,0
1495,It would possible to predict the time of this pandemic?,0
186,How many confirmed cases in Ontario now?,0
230,Chlono,0
1556,How to take care of infected people ,0
1558,I have a bit of nausea and headache. Do i have covid-19?,0
1565,Sorry I het enter before I was done.. am I just being paranoid and giving myself an ulcer.. my husband has pulmonary fibrosis so I’m really worried about him ,0
1577,"If this is really deep learning, how deep is your model😂",0
1511,I had a bronchitis last month and I'm still having trouble with my breathing a month later but I don't have a fever. Could it be corona virus?,0
813,How many thing you do not understand,0
814,"Do we have this epidemic, and many more to come, because we're not taking care of the earth, we're destroying more and more trees, and humans are eating more wild animals that have viruses, per a talk from Alanna Shaikh?",0
1614,Should I be moving house during a pandemic?,0
187,"If I’m sneezing, should I get tested for corona virus?",0
635,What should I do?,0
809,How am I supposed to work while I have two young children at home?,0
190,Is headache a symptom of this pandemic? ,0
1468,When this virus terminated?,0
1613,Is it transmissible through anal sex ?,0
194,How much longer will society need to socially isolate?,0
1620,Should I visit my parents in a seniors home?,0
1615,when will germany reach the peak?,0
835,"If I am starting to breath heavily, should I get it checked out?",0
202,mental health,0
1483,Suffering from trout echiting,0
1493,i have some headeche,0
820,waht are thenoptiin to disinfect hands and surfaces other than soap and alcohol,0
680,What is the number of Covid19 cases in the wold,1
1794,What is the death rate in South Carolina?,1
696,What is the mortality rate?,1
1206,Number of cases in Inida,1
628,how many deaths are in Italy as of March 21,1
1544,Mortality rate today,1
156,Why Germany has a low death rate?,1
1650,What is the total number of deaths ,1
908,What was the total number of deaths before and after the virus?,1
1247,how many death now,1
1385,"What are the daily death rates in Italy, that are Not from COVID19?",1
1195,How many death in Quebec?,1
873,I am feeling sick ,2
941,What should I do if I start feeling sick with similar symptoms as in covid19?,2
815,What shall I do if I have to go out to buy things to protect myself from corona virus?,2
722,Could stores open a few hours a week for the elderly? ,2
687,Are vet clinics still open?,2
534,Do I need to disinfect things I buy like groceries and supplies?,2
188,Are we going to have trouble buying milk? ,2
1670,What should I buy from the stores now that I feel sick?,2
360,"How can I make sure, I am buying from grocery is safe from COVID-19 ",2
1046,What should I use to disinfect grocery bags and grocery items? ,2
349,is the grocery open?,2
1540,is the liquor store open?,2
1036,How long will I be sick if I get the virus,2
516,Will the groceries shut down?,2
871,How many patients are across the globe? ,3
1478,How do I distinguish between the flu and coronavirus?,3
563,How can I differ between covid and normal flu ?,3
869,Is there a different varient of virus which is spreading across the world,3
310,Why are death rates so different across countries?,3
986,What's the difference between COVID-19 and CoronaVirus?,3
1148,"What are differences in term of symptoms between the new coronavirus and normal flu, cod",3
639,How do I know if I have the flu or coronavirus,3
1205,What the different between corona and COVID_19?,3
1681,What is the difference between a bacteria and a virus?,3
953,How to differentiate between coronavirus and simple flu?,3
1623,What is most usual symptom of Covid-19 ,4
1607,what has caused it,4
1594,Does the amount of virus one is exposed to change the severity of the symptoms?,4
1553,When will it stop spreading? Is 2 weeks enough? ,4
812,Where do I go if I have mild symptoms?,4
1626,how can one fight the virus ,4
1810,Can I get Ovid 19 if someone pets my dog and then I pet her? ,4
780,Does my neighbour have covid-19 symptoms?,4
1648,COVID-19 stands for what?,4
1838,What are the top symptoms ,4
1541,What's a waiting time to get covid-19 results?,4
736,What are the real symptoms of covid-19 ,4
1718,"My COVID-19 test results are pending, and my temperature reached 40C. What should I do?",4
1756,"When having covid-19, What are the next possible symptoms for a 4 years old child",4
710, When should I consult after the vomitting symptoms for a 4 y-o child? ,4
1768,How long after testing do you receive your COVID-19 results? ,4
709,What are the early symptoms of COVID-19,4
1800,What is the likelihood of having covid if only showing one symptoms for example dry cough,4
700,Does COVID 19 cause stomach issues,4
1637,What about the researches with respect to treatment of COVID-19,4
757,Can you catch covid 19 after having had it before ,4
1445,Is it possible to have Covid-19 if you only have one of the symptoms?,4
1507,I have a lot of stress regarding COVID-19,4
1023,What is covid 29,4
1034,My brother has COVID-19. What to do?,4
1064,"if someone had pneumonia before, are they more at risk?",4
1093,Can you smoke cannabis during Covid?,4
1102,Will people on LTD (Long Term Disability) drill receive their payments?,4
1112,What are the covid simptons?,4
1114,"I would like to get COVID19 test, where can I get it?",4
1130,What do I do if someone with COVID-19 spotted?,4
1181,What COVID-19 stands for?,4
1244,"On a recent study published in ""Nature"" ,it says that the severity of symptoms of COVID-19 infection depends on how much is your Angiotensin converting enzyme 2 gene is expressed ,my question is ,on what factors does the rate of ACE2 gene expression depends? I",4
1254,Do the symptoms start suddenly or they progress slowly from one day to another? ,4
1268,"If I catch the virus, will I be immune from getting it again?   ",4
1272,What are you symtoms of covid? ,4
1305,Is there more than one strain of COVID-19?,4
1321,What colour is covid 19?,4
882,how old are you?,4
880,what is covid-2019,4
1343,"I’ve have mild cough and not the continuous one. And symptoms of fever like burning eyes, but not the temperature. What do I do?",4
1349,Infomation about covid,4
1395,hat should I do if my 2 year old child starts having a runny nose?,4
851,What is the origin of COVID-19?,4
849,what are the risks for someone aged 65?,4
1500,What the size,4
1514,what are the symtoms,4
958,Can my cat get the virus?,4
1852,"If I cross someone on the street, how are the chance to catch the virus ?",4
249,what are the conditions under which people are most likely to develop complications versus those who won’t?  ,4
531,I heard hydroxychloroquine is a good treatment for COVID-19. Where can I get it?,4
573,what are cov19 symptoms,4
537,Are research fundings going to be cut as a result of the virus?,4
164,Will Covid19 go away like the 1918 influenza and SARS did,4
256,Can I get the virus from a stray cat?,4
642,I feel heaviness  in my chest nothing else from last 2 week ,4
254,Will the largest commercial suppliers in the country be urged to provide necessities for each household for delivery? We have Sobey’s Loblaw Amazon Walmart and Intelcom who do this today but in an unconcerted way. ,4
546,age wise statistics for covid-19,4
155,What is the incubation time of the virus?,4
632,How do I know if my chest is hurt because lung damage or another cause?,4
630,Whatbare the symptoms,4
246,"As of today, can we gather only 2",4
621,"If I'm below the age of 30, will I notice symptoms if I'm sick?",4
567,What are the symptoms of SARS-COV-2,4
232,if my tempreture is over 39 can i assume that i have covid-19 ?,4
503,What is the incubation time of covid-19 by age,4
489,How severe is the virus? ,4
229,when covid 19 is going to stop?,4
377,good morning,4
11,Do you think Taiwan is good?,4
372,I would like clarifications about the fact that test results don't work if you don't have symptoms. That does not seem like a commonality we usually see with tests like this.,4
326,What are the most common symptoms of COVID-19?,4
1002,What are the risks for people with diabetes? ,5
982,What is the risk for an asthmatic ?,5
1277,what is my level of risk?,5
802,How dangerous it is for pregnant womens?,5
955,What is the risk for a pregnant women?,5
350,Who is at risk?,5
1118,Are there any risk for the foetus? ,5
1772,If I have diabetes am I at a higher risk? ,5
825,Who is most at risk? ,5
10,What mesures needs to take a pregnant women to reduce the risk?,5
340,how many cases are there in Washington state,6
1220,How many cases are in spain ?,6
1301,How many cases in Canada now ? ,6
617,How many cases in Montreal,6
1489,how many new cases,6
996,How many cases in Montreal ,6
654,How many case in montreal,6
1487,What places of laval has covid-19,6
289,How many cases in Montreal?,6
1032,How many cases of covid in laval,6
218,How many cases in Quebec? ,6
1008,How many cases in Quebec ,6
1702,How many cases of coronavirus in Madagascar,6
1211,Is it ok to go outside to get fresh air?,7
321,Where should I go?,7
236,Am I allowed to go for a walk?,7
1397,Is it safe to go outside for a walk (social distancing from others)?,7
1539,Is it dangerous to go for a walk?,7
592,Should I go to the ER or my physician directly if I'm infected?,7
1676,When can I go to my cabin?,7
723,if i have symptoms should i go to the ER or should I call a doctor?,7
1798,Is it safe to take a walk outside with my child?,7
981,When should I go to the ER?,7
664,When will it be ok to go outside?,7
160,how is going,7
872,How i know that i 'm ill,8
1450,How do I know if I have been infected?,8
1423,How do I know I have covid?,8
501,what do you know about COVID-19?,8
1051,how to know if i have corona,8
252,may I know what is corona?,8
600,How do I know if I have the corona virus,8
1175,how to know that somebody have a corona,8
1657,How do I know when to get tested?,8
1655,How to know if I get COVID-19 or not?,8
713,How do I know if I have the covid-19,8
13,How do I know if I haver coronavirus?,8
1058,"If you recover from the virus, can you still be a carrier ",9
15,Is the Asymptomatic Carrier a temporary status? ,9
1173,How long does it take an average person to recover?,9
734,If I fully recover from COVID-19 would I still be considered a carrier and transmit the virus?,9
876,How long does it take to recover?,9
1377,What is an Asymptomatic Carrier?,9
1693,How does it take to recover from the virus?,9
1572,How long does it take to recover?,9
1748,how i can test if i have the diease?,10
1639,where can I get tested,10
1015,"If I experience symptoms but they are manageable, should I still go to the hospital for testing?",10
1407,I was very sick with covid symptoms in late February and still coughing . Should I go get tested,10
1703,"To get an idea of how widespread the virus is, why don't we simply test a random sample of people?",10
1421,"If my son if suppose to get tested tomorrow, but just starting to feel better. Can I cancel or should we still go?",10
1736,What are covid-19 test centres location in Montreal?,10
800,Where can I get tested?,10
1057,where can I test for covid,10
300,Is the test covered in in CIHIP?,10
1219,List of Canadian hospitals treating (not testing) patients with COVID-19?,10
385,Where should I be tested ?,10
201,Where are the testing centers located in Mtl?,10
1208,Where do we get the test for COVID-19?,10
1306,Were can I get tested? ,10
162,Does covid-19 test anonymous?,10
207,which hospital takes the test for covid 19?,10
649,Where is the closest testing facility to me?,10
1155,"In this time of crisis, is it okay to feed the raccoons",11
1209,how long does COVID-19 virus lasts in the body?,11
1323,How long does COVID-19 live on glass surfaces?,11
1274,How long can the virus live?,11
740,How long am I infectious for,11
1374,What do I have to expect after the disease?,11
316,I am 43. What’s the chance of my survival if I get covid. ,11
1072,How long does the virus survive on a surface like a doorknob?,11
476,When do I expect to hear back from you? ,11
420,Is it true that COVID-19 can survive up to a few days on hard surfaces?,11
1716,How long is this expected to last?,11
695,How long does the virus live on clothes?,11
781,How long can the covid-19 survive outside the body,11
1691,is it made by human or by nature,11
1498,Is there an estimate as to how long the crisis will last?,11
922,How long does the virus remain active and alive after attacking a human body?,11
572,I'd love to know how long I can be contagious?,12
1139,Can we be contagious when we don't show symptoms?,12
643,How many days can you be contagious without showing symptoms?,12
1780,How contagious is the virus?,12
775,Can I be contagious even if I don't have symptoms? ,12
1823,If you start showing flu symptoms should you consult a doctor or stay home?,12
755,How long until an infected person shows symptoms?,12
1667,"If I have covid-19, how long will I be contagious?",12
607,How long before symptoms start to show? ,12
223,How long are you contagious if you have Coronavirus?,12
1054,Is COVID-19 air-borne?,13
1819,Should I stay home?,13
1088,"If I have symptoms and I am told to stay home, can I take Tylenol?",13
892,Does the  virus stay on clothing?,13
727,How long does the virus stay in paper money and coins?,13
161,Can the Covid survive in the air?,13
925,Is staying at home mandatory?,13
1136,How long can the virus stay in the air,13
1319,Shall we stay where we are or travel to our home country?,13
1747,Does covid transfer through air?,13
129,Do the virus stay in air?,13
1228,How long will it take for a vaccine to be produced?,14
253,What is a vaccin becoming available?,14
1846,Is there a vaccine for corona virus?,14
1586,How long before we have a vaccine for corona? ,14
167,Is there a vaccine for corona virus?,14
1180,How long will it take to develop a vaccine ? ,14
1674,When is the vaccine available ?,14
846,What's covid19,15
4,What's covid19?,15
1608,Covid19,15
993,What is covid19?,15
323,What's covid19? ,15
189,What is Covid19,15
293,What are the symptoms of the covid19?,15
767,What are the symptoms of covid19,15
773,What are the symptoms of covid19?,15
1387,What are the Symptom for covid19,15
1848,how many people related covid-19,16
394,how to interact with people,16
297,How do people get infected with Coronavirus?,16
357,How many people are infected in Lithuania?,16
1119,How many people are infected in toronto,16
674,how many people in America?,16
694,How many people have it in my town?,16
1661,how many case positive with COVID-19 ?,16
1673,how many people positive with Covid-19 in the world?,16
338,how many people positive result with COVID-19,16
1293,how long people live after being infected by coronavirus,16
928,How many COVID-19 related deaths have there been in Montreal?,16
1178,How can i cure covid-19?,17
1063,In how many days can covid be cured? ,17
1662,"Once you are cured from Covid-19, can you catch it again?",17
590,When will the cure be available ?,17
829,how many people have died in the US?,18
1438,How many people died in Belgium?,18
61,How many people have dies,18
1746,how many people died so far?,18
1404,How many people died in NYC,18
1504,how many people have died,18
1223,how many people die for cover?,18
989,Can I die from Covid-19?,18
481,how many people died?,18
711,How does it die in asymptomatic people?,18
666,What is the probability of dying?,18
311,How does COVID-19 kill its victims?,19
1357,Does soap really kill the virus?,19
308,Is it true that warm kills Coronavirus?,19
1262,If I inhale a high concentration of soap bubbles would that kill the virus on contact in my lungs?,19
353,Is it true that warm kills Coronavirus?,19
743,Is the virus vulnerable to high temperature?! Does steam cleaning the surfaces and cloths kills the virus?,19
464,Will high temperature kill coronavirus?,19
1708,What are the symptoms I should feel if I am infected with Corona virus?,20
1646,I'm feeling dizzy with fever do I have corona? ,20
1287,What is corona virus?,20
1834,What is corona,20
1134,Does the fever persists in corona ,20
1653,What are the symptoms of corona virus,20
1299,Corona virus characteristics,20
1496,How many Canadians currently have corona virus?,20
330,Symptoms of corona,20
1307,is there a new form of corona virus?,20
241,what is the death rate of the new corona virus,20
760,What are the symptoms of Corona?,20
