,question,ahc_label
331,I have cold for couple of weeks. Have cough over night and regular mucous during day and night. Feel a bit hot but not fever that can be feel. Sometimes ear pain for infection. Some times get stressed on having corona. Does any of these symptoms suggest that? I have quarantined myself for over 10 days  ,20
1591,Why is called COVID-19,20
1753,What is corona,20
776,Why is it called Corona virus?,20
1059,What are the symptoms of corona virus,20
679,Whats corona,20
1186,What is corona virus and COVID19,20
1185,I have fever 38°C. Is that corona virus symptoms?,20
1735,How is the corona virus being spread,20
1333,What's the current count in India,20
1424,can you please tell me symptoms of corona virus?,20
177,Does a throat feel itchy or really sore and a symptom ,21
954,I have a sore throat. What do I do?,21
1796,I have a sore throat. Is that a sign of Covid19?,21
430,I have throat ,21
199,Is itchy throat sign of covid 19,21
1765,I am feeling itchy around my body. Is it a symptom of covid? ,21
1436,Is sore throats a symptom ,21
629,"I am having sore throat, cold, cough, temperature is not stable continuously increases and decreases. So Do I need to go for a test?",21
1294,Get I get infected from a dog?,22
1066,Can I get infected after I healed from it?,22
1597,"Does Pneumonia vaccine, which is for a bacterial infections, helps the immune system to deal with the viral infection of Covid-19 more easily? By removing the possibility of bacterial infection and just focusing on viral infection!",22
1815,From the infected worldwide population what will be the ratio of asymptomatic people,22
593,Which country infected ? ,22
451,What do I do if I suspect I'm infected?,22
890,What is the estimated population that will be infected by the covid-19 virus?,22
1363,Can antibiotics deal with viral infection?,22
27,Which country infected ? ,22
1452,From the infected worldwide population what is the ratio that will need medical attention (eg. ICU or ventilators)?,22
396,Am I infected,22
1564,"If someone was infected once, can they be reinfected? Can they still carry the virus and infect others?",22
995,What is Covid-19 virus?),22
929,Can you get be infected more than once? ,22
1849,How COVID-19 is infecting?,22
1654,How covid-19 virus infected?,22
440,I cough. is it Covid-19?,23
354,is coughing phlem a symptom?,23
756,I am coughing but I don't have fever. Could I have covid-19?,23
1200,What to do when i gave cough,23
733,Is a cough but no fever a symptom?,23
1161,"i am coughing, what should i do?",23
469,What if I have cough ?,23
1331,How long does it takes to get first symptom of Covid-19 ,24
1401,Which are its first symptoms?,24
1334,Why didn't you answer my first question?,24
303,What's the point of asking you questions if you don't have answers,24
570,Do I have to ask a sclerotic question about traveling or something to get an answer ,24
1184,Doeas the software is automatic in English because I use an English device? If I ask in French the answer will be in French?,24
1215,"If you contract COVID-19, how do you treat yourself at home?",25
299,who is at risk of dying after contracting the virus?,25
646,Can anti-viral drugs be used to treat the coronavirus?,25
1642,What are the side-effects of hydroxychloroquine for treating COVID-19?,25
1802,Can you die from contracting covid?,25
728,How effective is the new drug manufactured by Fujifilm Toyama Chemicals in treating COVID-19?,25
295,How do I treat coronavirus?,25
1803,Is it safe to jog/run outside?,26
650,Can I go for a run? Does running/exercise compromise my immune system? ,26
1104,Can I run outside,26
857,Option to run the questions for children ,26
471,My  father is 80 years and food is delivered to him daily. Can food containers and food itself be contaminated by COVID,27
1644,Is ordering food from a restaurant discouraged?,27
358,What are the best food to get good immune ,27
633,Is it safe to order food during the COVID-19 pandemic?,27
1402,Can I get infected from food or grocery delivery?,27
336,where can I help?,28
1760,Does Wearing gloves help?,28
1822,Does eating Oranges daily help to fight this virus,28
118,Will the heat of the summer help fighting the virus?,28
163,What kind of medication can I take if I have the virus ?,28
821,what kind of protective gear do i need to wear?,28
278,Can drinking alcohol helps COVID19? ,28
720,how much does corona virus stay on each kind of surfaces?,28
1392,Is there any medication to take to help?,28
714,What is the incubation period? ,29
233,Is the virus infectious during incubation period?,29
1587,How long does this virus incubate? ,29
712,What is the period of incubation?,29
1156,How long is incubation period? ,29
619,What is the incubation period for COVID-19?,29
659,What’s the incubation period? ,29
1300,what treatments are available for covid-19?,30
1542,Is there a treatment for corona virus?,30
863,How long is the treatment?,30
1075,treatment for covid 19,30
206,When will the treatment be available for this pandemic?,30
1473,When will covid end? ,31
595,when will the pandemic end?,31
359,when is this pandemic going to end?,31
1199,When will the pandemic end? ,31
623,When will this end,31
817,When this will ever end ,31
1327,What is the situation right now in the world?,32
211,What is the current situation of COVID-19 infections?,32
1717,What is the situation now in my country?,32
393,How about covid situations? ,32
390,what is canada's situation right now?,32
599,How deadly is the virus?,33
1506,Is the virus deadly?,33
1706,How deadly is the virus?,33
1530,How long do you think we will have to be in a lockdown ,34
1579,what should I do if I think I infected by corona virus?,34
1704,What to do if I think I have covid 19?,34
2,I think I have a fever. What do I do?,34
381,"I think I have coronavirus, should I go to the emergency",34
1043,I think I have COVID,34
461,I think I’m sick,34
706,What should I do if i think that i'm infected ?,34
678,How long does it last once infected ?,35
631,How long does it last? ,35
1144,"How long the sickens last, m",35
1049,How long will it last?,35
1845,How long do the symptoms of COVID-19 last for?,35
1351,How long will the pandemic last?,35
1707,How is it transmitted?,36
1207,How did this virus transmit?,36
520,How is covid transmitted?,36
284,How does COVID-19 spread?,37
1055,How does Covid-19 spread?,37
1007,is china responsible for the spreading of COVID-19?,37
213,How does it spread ?,37
280,how is covid 19 spread?,37
5,Does the virus spread by rain?,37
1242,how to prepare for spread of covid 19?,37
12,How's the shortness of breath?,38
1326,I have shortness of breath but no fever,38
1408,What should i do if i am short of breath?,38
1520,What are the symptoms of COVID-19,39
735,What are the symptoms of Covid-19?,39
276,what are the symptoms of COVID-19?,39
1226,What are the symptoms of Covid-19?,39
844,What is the covid-19 symptoms? ,39
1198,What are the symptoms of COVID-19?,39
1174,What are the symptoms of COVID-19?,39
1346,symptoms of covid-19,39
1368,what are covid-19 symptoms?,39
1182,what are the symptoms of covid-19,39
447,Symptoms of Covid ,39
1378,what are covid symptoms,39
258,Impact of covid,40
1281,What will be th impact on international students?,40
1624,Impacts of it,40
26,What is the impact that covid-19 has in the economy?,40
1419,what are the symptoms of coronavirus,41
1566,What should I do if I have Coronavirus symptoms?,41
1688,what is coronavirus,41
83,What is coronavirus ?,41
1652,Can I get the virus from breathing infected airborn particules,42
1574,Is the virus airborne ,42
1526,Is Covid19 an airborne? ,42
798,Can this virus infect me in an airborne fashion?,42
1146,What is self-isolation?,43
1030,what is self monitoring?,43
1258,what is self isolation?,43
1508,"If I'm in self-quarantine with mild symptoms of some sort of respiratory thing, when can I stop self-quarantining?",43
1729,Can you see friends if you stick to the social distancing guidelines?,44
616,what is social distancing?,44
1725,My employer is not implementing social distancing or safety measures in my workplace. What recourse do I have?,44
1267,How long will social distancing measures last?,44
301,Will social distancing slow the spread of covid-19?,44
389,What are the main synptoms?,45
1417,What is the main symptoms of the disease related to new coronavirus,45
383,Is fever the main symptom for vivid-19,45
220,What are the symptoms of vivid 19?,45
594,what are the main symptoms of coronavirus,45
505,what are the main symptoms,45
1018,how to prevent ?,46
491,how can I prevent to get infected?,46
1668,How to prevent the spread of COVID-19?,46
842,What is COVID-19,47
1163,What is covid-19?,47
790,what is covid-19 ?,47
538,What is covid 19?,47
1240,What is COVID 19,47
23,What is Covid-19?,47
1497,What is covid-19?,47
1025,Why Covid 19?,47
1510,What is COVID-19?,47
1534,what is covid-19,47
1031,what is covid 19,47
1131,What is Covid 19,47
45,What is the COVID-19?,47
1290,what is covid-19,47
1273,What is COVID-19?,47
1609,Covid-19,47
603,What is COVID 19?,47
1261,About COVID-19,47
356,what's is COVID-19?,47
1825,What’s COVID-19?,47
8,what is covid-19,47
470,Covid-19,47
29,What is covid,48
25,What is the covid?,48
544,What is covid,48
522,What is covid?,48
609,What is covid,48
579,Covid?,48
1353,Do I have covid?,48
413,What are the symptoms,49
1444,What are the symptoms?,49
143,what are the symptoms,49
1529,What are the symptoms,49
1009,What do I do if I have symptoms?,49
1014,What are symptoms ,49
375,What are the symptoms,49
754,Symptoms,49
380,what are the symptoms,49
384,What are the symptoms ,49
1251,Symptom,49
1084,What are the Symptome ,49
830,Symptom,49
1345,what is the symptoms?,49
1832,What are the symptoms,49
1341,What should I do if I start coughing?,50
681,How Covid-19 started?,50
653,where did it start,50
1380,"I have a fever, what should I do now?",51
950,What should I do if I have fever?,51
550,"Must the fever-symptom related to COVID-19 be a continuous fever, or is it possible that the fever is short-lived?",51
753,is fever a symptom of coronavirus? ,51
176,I have fever what I should do,51
281,How can I make the difference between a cold and covid19?,52
931,Do i have a covid or is it just a cold?,52
1121,Who can I make the difference between a cold and covid19?,52
822,"My head hurts, my body aches a little and I feel a cold coming. How do I know if this is Covid-19 or just an ordinary cold?",52
952,is covid-19 dangerous,53
1743,Why corona is so dangerous ,53
557,Is covid very dangerous,53
1773,is it dangerous to travel,53
1813,How dangerous is the COV-19?,53
1221,What is the meaning of COVID-19?,54
1165,Does COVID-19 spread by means of gametes?,54
159,I have cough. Does that mean I might be infected?,54
262,Will herd immunity be the only means of eradicating COVID-19?,54
913,What is the nearest hospital to go to if I have a COVID-19?,55
536,should I go to the hospital?,55
1391,When should I go to the hospital ,55
1,When should I go to the hospital?,55
1801,What can we do to protect ourselves from COVID-19?,56
1821,How can I protect myself ,56
556,How to protect myself on a plane,56
576,how to protect myself from it ,56
765,How can I protect myself from the covid-19?,56
351,How to protect my family from COVID-19?,56
1045,Do I have to wear a mask all the time if I am not infected?,57
478,Do I need a mask?,57
542,Does a mask actually help if I'm not sick?,57
325,Should I wear mask,57
615,Is it useful to wear a mask if we are not sick?,57
1322,"Why does the government think that we don't need to wear face masks when clearly citizens from countries that are able to contain the virus are all wearing face masks, regardless if they are sick or not",57
