,question,ahc_label,cluster
1408,What should i do if i am short of breath?,2,nextsteps
331,I have cold for couple of weeks. Have cough over night and regular mucous during day and night. Feel a bit hot but not fever that can be feel. Sometimes ear pain for infection. Some times get stressed on having corona. Does any of these symptoms suggest that? I have quarantined myself for over 10 days  ,2,nextsteps
1511,I had a bronchitis last month and I'm still having trouble with my breathing a month later but I don't have a fever. Could it be corona virus?,2,nextsteps
756,I am coughing but I don't have fever. Could I have covid-19?,2,nextsteps
1380,"I have a fever, what should I do now?",2,nextsteps
2,I think I have a fever. What do I do?,2,nextsteps
12,How's the shortness of breath?,2,nextsteps
1779,"should I call to find out more, it’s the coughing and difficulty breathing and fatigue that worries me",2,nextsteps
1185,I have fever 38°C. Is that corona virus symptoms?,2,nextsteps
733,Is a cough but no fever a symptom?,2,nextsteps
1161,"i am coughing, what should i do?",2,nextsteps
1134,Does the fever persists in corona ,2,symptoms
1200,What to do when i gave cough,2,nextsteps
281,How can I make the difference between a cold and covid19?,3,
14,covid19 symptons?,3,symptoms
1385,"What are the daily death rates in Italy, that are Not from COVID19?",3,
293,What are the symptoms of the covid19?,3,symptoms
189,What is Covid19,3,about
1526,Is Covid19 an airborne? ,3,about
1608,Covid19,3,about
4,What's covid19?,3,about
1548,What are the confirmed symptoms of COVID19,3,about
164,Will Covid19 go away like the 1918 influenza and SARS did,3,symptoms
941,What should I do if I start feeling sick with similar symptoms as in covid19?,3,nextsteps
669,Can you explain to me what is the covid19?,3,about
846,What's covid19,3,about
323,What's covid19? ,3,about
773,What are the symptoms of covid19?,3,symptoms
767,What are the symptoms of covid19,3,symptoms
278,Can drinking alcohol helps COVID19? ,3,
1121,Who can I make the difference between a cold and covid19?,3,
993,What is covid19?,3,about
1387,What are the Symptom for covid19,3,symptoms
680,What is the number of Covid19 cases in the wold,3,cases
1796,I have a sore throat. Is that a sign of Covid19?,3,nextsteps
1307,is there a new form of corona virus?,4,about
1743,Why corona is so dangerous ,4,why
1542,Is there a treatment for corona virus?,4,
1424,can you please tell me symptoms of corona virus?,4,symptoms
1834,What is corona,4,about
330,Symptoms of corona,4,symptoms
1846,Is there a vaccine for corona virus?,4,
1496,How many Canadians currently have corona virus?,4,cases
720,how much does corona virus stay on each kind of surfaces?,4,spread
1287,What is corona virus?,4,about
1059,What are the symptoms of corona virus,4,symptoms
1753,What is corona,4,about
1299,Corona virus characteristics,4,
776,Why is it called Corona virus?,4,why
1653,What are the symptoms of corona virus,4,symptoms
1708,What are the symptoms I should feel if I am infected with Corona virus?,4,symptoms
815,What shall I do if I have to go out to buy things to protect myself from corona virus?,4,
429,"Hello, what happens after corona?",4,
1735,How is the corona virus being spread,4,
760,What are the symptoms of Corona?,4,symptoms
1205,What the different between corona and COVID_19?,4,
1586,How long before we have a vaccine for corona? ,4,
1579,what should I do if I think I infected by corona virus?,4,
241,what is the death rate of the new corona virus,4,cases
679,Whats corona,4,about
1186,What is corona virus and COVID19,4,about
167,Is there a vaccine for corona virus?,4,
928,How many COVID-19 related deaths have there been in Montreal?,5,cases
1711,How many days does it take to see the symptoms,5,cases
1702,How many cases of coronavirus in Madagascar,5,cases
628,how many deaths are in Italy as of March 21,5,cases
917,Were there documented cases before January 2020?,5,cases
1661,how many case positive with COVID-19 ?,5,cases
1489,how many new cases,5,cases
654,How many case in montreal,5,cases
643,How many days can you be contagious without showing symptoms?,5,cases
218,How many cases in Quebec? ,5,cases
909,What is the current COVID-19 confirmed cases trend for Canada?,5,cases
617,How many cases in Montreal,5,cases
871,How many patients are across the globe? ,5,cases
186,How many confirmed cases in Ontario now?,5,cases
813,How many thing you do not understand,5,
289,How many cases in Montreal?,5,cases
1026,How many days should I isolate for,5,
996,How many cases in Montreal ,5,cases
1063,In how many days can covid be cured? ,5,
1008,How many cases in Quebec ,5,cases
1247,how many death now,5,cases
1220,How many cases are in spain ?,5,cases
1206,Number of cases in Inida,5,cases
1032,How many cases of covid in laval,5,cases
340,how many cases are there in Washington state,5,cases
1301,How many cases in Canada now ? ,5,cases
1195,How many death in Quebec?,5,cases
1293,how long people live after being infected by coronavirus,6,
1566,What should I do if I have Coronavirus symptoms?,6,
353,Is it true that warm kills Coronavirus?,6,
1265,"I was in contact with a person who had coronavirus, what should I do? ",6,
297,How do people get infected with Coronavirus?,6,
223,How long are you contagious if you have Coronavirus?,6,
1478,How do I distinguish between the flu and coronavirus?,6,
986,What's the difference between COVID-19 and CoronaVirus?,6,
1038,What is the half-life of coronavirus?,6,
646,Can anti-viral drugs be used to treat the coronavirus?,6,
594,what are the main symptoms of coronavirus,6,
381,"I think I have coronavirus, should I go to the emergency",6,
295,How do I treat coronavirus?,6,
308,Is it true that warm kills Coronavirus?,6,
1847,Is the phlegm color suggestive of coronavirus? ,6,
464,Will high temperature kill coronavirus?,6,
1148,"What are differences in term of symptoms between the new coronavirus and normal flu, cod",6,
1688,what is coronavirus,6,
953,How to differentiate between coronavirus and simple flu?,6,
1419,what are the symptoms of coronavirus,6,
1417,What is the main symptoms of the disease related to new coronavirus,6,
335,How does coronavirus propagate?,6,
1203,Should I use asprin with I have the coronavirus?,6,
753,is fever a symptom of coronavirus? ,6,
83,What is coronavirus ?,6,
883,"If there are kids around me, do I have to worry if they are infected and I do not know?",7,
872,How i know that i 'm ill,7,
252,may I know what is corona?,7,
1655,How to know if I get COVID-19 or not?,7,
1264,"What measures can I take, if someone I know is effected with the virus",7,
501,what do you know about COVID-19?,7,
713,How do I know if I have the covid-19,7,
1175,how to know that somebody have a corona,7,
822,"My head hurts, my body aches a little and I feel a cold coming. How do I know if this is Covid-19 or just an ordinary cold?",7,
632,How do I know if my chest is hurt because lung damage or another cause?,7,
639,How do I know if I have the flu or coronavirus,7,
1051,how to know if i have corona,7,
13,How do I know if I haver coronavirus?,7,
572,I'd love to know how long I can be contagious?,7,
600,How do I know if I have the corona virus,7,
1450,How do I know if I have been infected?,7,
589,What have you implemented to help older people who do not know how to use the internet/phone to obtain their groceries and medicine?,7,
1423,How do I know I have covid?,7,
1716,How long is this expected to last?,8,
1351,How long will the pandemic last?,8,
1498,Is there an estimate as to how long the crisis will last?,8,
1173,How long does it take an average person to recover?,8,
678,How long does it last once infected ?,8,
1209,how long does COVID-19 virus lasts in the body?,8,
863,How long is the treatment?,8,
1572,How long does it take to recover?,8,
1228,How long will it take for a vaccine to be produced?,8,
1049,How long will it last?,8,
631,How long does it last? ,8,
1331,How long does it takes to get first symptom of Covid-19 ,8,
755,How long until an infected person shows symptoms?,8,
1144,"How long the sickens last, m",8,
740,How long am I infectious for,8,
1530,How long do you think we will have to be in a lockdown ,8,
1845,How long do the symptoms of COVID-19 last for?,8,symptoms
781,How long can the covid-19 survive outside the body,8,about
1768,How long after testing do you receive your COVID-19 results? ,8,test
1667,"If I have covid-19, how long will I be contagious?",8,
1323,How long does COVID-19 live on glass surfaces?,8,
876,How long does it take to recover?,8,
1180,How long will it take to develop a vaccine ? ,8,
607,How long before symptoms start to show? ,8,
1267,How long will social distancing measures last?,8,
946,Does everyone infected need a respirator?,9,
1066,Can I get infected after I healed from it?,9,
798,Can this virus infect me in an airborne fashion?,9,
396,Am I infected,9,
154,How many infected person in south korea?,9,
159,I have cough. Does that mean I might be infected?,9,
1402,Can I get infected from food or grocery delivery?,9,
1654,How covid-19 virus infected?,9,
1119,How many people are infected in toronto,9,
491,how can I prevent to get infected?,9,
1400,Is it possible to be infected again?,9,
1849,How COVID-19 is infecting?,9,
1363,Can antibiotics deal with viral infection?,9,
1815,From the infected worldwide population what will be the ratio of asymptomatic people,9,
27,Which country infected ? ,9,
1197,"What are the demographics of people infected, hospitalized and deceased in Quebec, ",9,
706,What should I do if i think that i'm infected ?,9,
1652,Can I get the virus from breathing infected airborn particules,9,
357,How many people are infected in Lithuania?,9,
593,Which country infected ? ,9,
890,What is the estimated population that will be infected by the covid-19 virus?,9,
1556,How to take care of infected people ,9,
1564,"If someone was infected once, can they be reinfected? Can they still carry the virus and infect others?",9,
1045,Do I have to wear a mask all the time if I am not infected?,9,
929,Can you get be infected more than once? ,9,
1294,Get I get infected from a dog?,9,
211,What is the current situation of COVID-19 infections?,9,
1597,"Does Pneumonia vaccine, which is for a bacterial infections, helps the immune system to deal with the viral infection of Covid-19 more easily? By removing the possibility of bacterial infection and just focusing on viral infection!",9,
451,What do I do if I suspect I'm infected?,9,
619,What is the incubation period for COVID-19?,10,incubation
155,What is the incubation time of the virus?,10,incubation
233,Is the virus infectious during incubation period?,10,incubation
714,What is the incubation period? ,10,incubation
503,What is the incubation time of covid-19 by age,10,incubation
1156,How long is incubation period? ,10,incubation
1587,How long does this virus incubate? ,10,incubation
659,What’s the incubation period? ,10,incubation
712,What is the period of incubation?,10,incubation
1639,where can I get tested,11,test
1306,Were can I get tested? ,11,test
1208,Where do we get the test for COVID-19?,11,test
800,Where can I get tested?,11,test
385,Where should I be tested ?,11,test
1114,"I would like to get COVID19 test, where can I get it?",11,test
1057,where can I test for covid,11,test
1657,How do I know when to get tested?,11,test
1528,"if i think i have it, should i got get tested",11,test
1534,what is covid-19,12,about
603,What is COVID 19?,12,about
29,What is covid,12,about
25,What is the covid?,12,about
45,What is the COVID-19?,12,about
23,What is Covid-19?,12,about
579,Covid?,12,about
1031,what is covid 19,12,about
470,Covid-19,12,about
1510,What is COVID-19?,12,about
356,what's is COVID-19?,12,about
522,What is covid?,12,about
609,What is covid,12,about
1163,What is covid-19?,12,about
1240,What is COVID 19,12,about
842,What is COVID-19,12,about
1497,What is covid-19?,12,about
1273,What is COVID-19?,12,about
544,What is covid,12,about
1609,Covid-19,12,about
1131,What is Covid 19,12,about
995,What is Covid-19 virus?),12,about
1825,What’s COVID-19?,12,about
538,What is covid 19?,12,about
1290,what is covid-19,12,about
1025,Why Covid 19?,12,about
8,what is covid-19,12,about
1353,Do I have covid?,12,about
790,what is covid-19 ?,12,about
1261,About COVID-19,12,about
1848,how many people related covid-19,13,cases
338,how many people positive result with COVID-19,13,cases
694,How many people have it in my town?,13,cases
989,Can I die from Covid-19?,13,
1404,How many people died in NYC,13,cases
1438,How many people died in Belgium?,13,cases
1002,What are the risks for people with diabetes? ,13,cases
299,who is at risk of dying after contracting the virus?,13,
1504,how many people have died,13,cases
829,how many people have died in the US?,13,cases
394,how to interact with people,13,cases
1673,how many people positive with Covid-19 in the world?,13,cases
666,What is the probability of dying?,13,
674,how many people in America?,13,cases
1223,how many people die for cover?,13,cases
1746,how many people died so far?,13,cases
61,How many people have dies,13,cases
481,how many people died?,13,cases
1802,Can you die from contracting covid?,13,
711,How does it die in asymptomatic people?,13,
