,question,ahc_label
419,"Would it help eradicate viruses immediately if we put in place proper healthcare systems throughout every country, rich or poor, and to also have enough health professionals worldwide in place who will immediately recognize if there is a contagious virus in their city to eradicate it before it spreads?",30
1614,Should I be moving house during a pandemic?,30
1392,Is there any medication to take to help?,30
194,How much longer will society need to socially isolate?,30
1725,My employer is not implementing social distancing or safety measures in my workplace. What recourse do I have?,30
854,What precautions should I take with things delivered at home?,30
1050,what is pandemic,30
165,Are there still flights within Canada?,30
339,How often should i take my temperature?,30
1085,Will the pandemic affect university research?,30
188,Are we going to have trouble buying milk? ,31
1284,Can I go out after recovery even if I am still in quarantine time?,31
1798,Is it safe to take a walk outside with my child?,31
422,Is it safe for seniors to go out for a walk or inside shopping malls which are quite isolated these days?,31
592,Should I go to the ER or my physician directly if I'm infected?,31
282,Should I star home and even avoid going to the supermarket and drugstore?,31
1069,I am in self isolation.   Is it ok to let in family members who must continue to go to work?,31
888,Isn't the economy impact (and the panic reaction) going to kill more than the virus? It seems the virus only kills 1%... while over 30% of the population might lose their jobs.,31
537,Are research fundings going to be cut as a result of the virus?,31
1104,Can I run outside,31
650,Can I go for a run? Does running/exercise compromise my immune system? ,31
1530,How long do you think we will have to be in a lockdown ,32
1716,How long is this expected to last?,32
1572,How long does it take to recover?,32
1267,How long will social distancing measures last?,32
1498,Is there an estimate as to how long the crisis will last?,32
876,How long does it take to recover?,32
1228,How long will it take for a vaccine to be produced?,32
863,How long is the treatment?,32
1173,How long does it take an average person to recover?,32
1144,"How long the sickens last, m",32
740,How long am I infectious for,32
1180,How long will it take to develop a vaccine ? ,32
797,How do we best organize people so that duplicate work is not being done?,33
10,What mesures needs to take a pregnant women to reduce the risk?,33
1377,What is an Asymptomatic Carrier?,33
825,Who is most at risk? ,33
1118,Are there any risk for the foetus? ,33
1787,what is this rainbow thing that people are talking about,33
1277,what is my level of risk?,33
1073,what is the risk for a pregnent woman ?,33
350,Who is at risk?,33
249,what are the conditions under which people are most likely to develop complications versus those who won’t?  ,33
1722,I have asthma. How at risk am I about the possibility of complications?,33
1064,"if someone had pneumonia before, are they more at risk?",33
982,What is the risk for an asthmatic ?,33
955,What is the risk for a pregnant women?,33
849,what are the risks for someone aged 65?,33
1772,If I have diabetes am I at a higher risk? ,33
384,What are the symptoms ,34
1529,What are the symptoms,34
375,What are the symptoms,34
1444,What are the symptoms?,34
413,What are the symptoms,34
830,Symptom,34
143,what are the symptoms,34
1345,what is the symptoms?,34
1014,What are symptoms ,34
1009,What do I do if I have symptoms?,34
380,what are the symptoms,34
1084,What are the Symptome ,34
754,Symptoms,34
1832,What are the symptoms,34
1251,Symptom,34
631,How long does it last? ,35
1351,How long will the pandemic last?,35
1049,How long will it last?,35
1520,What are the symptoms of COVID-19,36
1198,What are the symptoms of COVID-19?,36
1346,symptoms of covid-19,36
1182,what are the symptoms of covid-19,36
276,what are the symptoms of COVID-19?,36
1226,What are the symptoms of Covid-19?,36
735,What are the symptoms of Covid-19?,36
1174,What are the symptoms of COVID-19?,36
844,What is the covid-19 symptoms? ,36
1368,what are covid-19 symptoms?,36
1831,should I worry about covid 19?,37
824,Where did COVID-19 come from?,37
1075,treatment for covid 19,37
1801,What can we do to protect ourselves from COVID-19?,37
952,is covid-19 dangerous,37
351,How to protect my family from COVID-19?,37
681,How Covid-19 started?,37
1181,What COVID-19 stands for?,37
757,Can you catch covid 19 after having had it before ,37
765,How can I protect myself from the covid-19?,37
1591,Why is called COVID-19,37
1814,How does covid 19 feel ,37
1648,COVID-19 stands for what?,37
1178,How can i cure covid-19?,37
1221,What is the meaning of COVID-19?,37
1553,When will it stop spreading? Is 2 weeks enough? ,38
869,Is there a different varient of virus which is spreading across the world,38
1000,How fast will the pandemic spread in Canada?,38
5,Does the virus spread by rain?,38
1739,How much the quarantine process has a positive impact on reducing contamination spread?,38
1579,what should I do if I think I infected by corona virus?,39
1708,What are the symptoms I should feel if I am infected with Corona virus?,39
1768,How long after testing do you receive your COVID-19 results? ,40
1331,How long does it takes to get first symptom of Covid-19 ,40
727,How long does the virus stay in paper money and coins?,41
1693,How does it take to recover from the virus?,41
1072,How long does the virus survive on a surface like a doorknob?,41
366,"How long could the virus stay alive on doorknobs, traffic signal buttons, stair rails?",41
1780,How contagious is the virus?,41
922,How long does the virus remain active and alive after attacking a human body?,41
627,How long do we need social distanciation for the virus to be less of a threat? ,41
394,how to interact with people,42
299,who is at risk of dying after contracting the virus?,42
666,What is the probability of dying?,42
1802,Can you die from contracting covid?,42
1002,What are the risks for people with diabetes? ,42
736,What are the real symptoms of covid-19 ,43
220,What are the symptoms of vivid 19?,43
1623,What is most usual symptom of Covid-19 ,43
326,What are the most common symptoms of COVID-19?,43
780,Does my neighbour have covid-19 symptoms?,43
1445,Is it possible to have Covid-19 if you only have one of the symptoms?,43
709,What are the early symptoms of COVID-19,43
27,Which country infected ? ,44
593,Which country infected ? ,44
1400,Is it possible to be infected again?,44
396,Am I infected,44
706,What should I do if i think that i'm infected ?,44
1186,What is corona virus and COVID19,45
1736,What are covid-19 test centres location in Montreal?,46
1219,List of Canadian hospitals treating (not testing) patients with COVID-19?,46
1541,What's a waiting time to get covid-19 results?,46
1718,"My COVID-19 test results are pending, and my temperature reached 40C. What should I do?",46
207,which hospital takes the test for covid 19?,46
162,Does covid-19 test anonymous?,46
531,I heard hydroxychloroquine is a good treatment for COVID-19. Where can I get it?,46
13,How do I know if I haver coronavirus?,47
639,How do I know if I have the flu or coronavirus,47
1735,How is the corona virus being spread,48
1450,How do I know if I have been infected?,49
1688,what is coronavirus,50
83,What is coronavirus ?,50
154,How many infected person in south korea?,51
1815,From the infected worldwide population what will be the ratio of asymptomatic people,51
1197,"What are the demographics of people infected, hospitalized and deceased in Quebec, ",51
1556,How to take care of infected people ,51
357,How many people are infected in Lithuania?,51
1119,How many people are infected in toronto,51
1657,How do I know when to get tested?,52
218,How many cases in Quebec? ,53
654,How many case in montreal,53
617,How many cases in Montreal,53
996,How many cases in Montreal ,53
289,How many cases in Montreal?,53
1489,how many new cases,53
1008,How many cases in Quebec ,53
1301,How many cases in Canada now ? ,53
1134,Does the fever persists in corona ,54
1646,I'm feeling dizzy with fever do I have corona? ,54
1185,I have fever 38°C. Is that corona virus symptoms?,54
600,How do I know if I have the corona virus,55
1051,how to know if i have corona,55
297,How do people get infected with Coronavirus?,56
753,is fever a symptom of coronavirus? ,57
995,What is Covid-19 virus?),58
29,What is covid,59
579,Covid?,59
544,What is covid,59
522,What is covid?,59
609,What is covid,59
1353,Do I have covid?,59
25,What is the covid?,59
456,Is it true that you can get the virus again even after you've recovered ,60
256,Can I get the virus from a stray cat?,60
1090,Can you get the virus twice ? ,60
958,Can my cat get the virus?,60
1268,"If I catch the virus, will I be immune from getting it again?   ",60
1849,How COVID-19 is infecting?,61
1654,How covid-19 virus infected?,61
1287,What is corona virus?,62
167,Is there a vaccine for corona virus?,62
1542,Is there a treatment for corona virus?,62
776,Why is it called Corona virus?,62
1846,Is there a vaccine for corona virus?,62
293,What are the symptoms of the covid19?,63
1387,What are the Symptom for covid19,63
773,What are the symptoms of covid19?,63
767,What are the symptoms of covid19,63
1156,How long is incubation period? ,64
1587,How long does this virus incubate? ,64
755,How long until an infected person shows symptoms?,65
607,How long before symptoms start to show? ,65
1845,How long do the symptoms of COVID-19 last for?,66
1055,How does Covid-19 spread?,67
280,how is covid 19 spread?,67
284,How does COVID-19 spread?,67
1639,where can I get tested,68
800,Where can I get tested?,68
1306,Were can I get tested? ,68
1378,what are covid symptoms,69
447,Symptoms of Covid ,69
989,Can I die from Covid-19?,70
1586,How long before we have a vaccine for corona? ,71
1242,how to prepare for spread of covid 19?,72
1668,How to prevent the spread of COVID-19?,72
1165,Does COVID-19 spread by means of gametes?,72
301,Will social distancing slow the spread of covid-19?,72
1007,is china responsible for the spreading of COVID-19?,72
678,How long does it last once infected ?,73
986,What's the difference between COVID-19 and CoronaVirus?,74
323,What's covid19? ,75
1608,Covid19,75
846,What's covid19,75
993,What is covid19?,75
189,What is Covid19,75
4,What's covid19?,75
187,"If I’m sneezing, should I get tested for corona virus?",76
829,how many people have died in the US?,77
1438,How many people died in Belgium?,77
711,How does it die in asymptomatic people?,77
1404,How many people died in NYC,77
1746,how many people died so far?,77
1223,how many people die for cover?,77
1504,how many people have died,78
481,how many people died?,78
61,How many people have dies,78
229,when covid 19 is going to stop?,79
913,What is the nearest hospital to go to if I have a COVID-19?,79
1753,What is corona,80
1834,What is corona,80
842,What is COVID-19,81
8,what is covid-19,81
1261,About COVID-19,81
538,What is covid 19?,81
1825,What’s COVID-19?,81
1290,what is covid-19,81
470,Covid-19,81
603,What is COVID 19?,81
1163,What is covid-19?,81
1273,What is COVID-19?,81
356,what's is COVID-19?,81
790,what is covid-19 ?,81
23,What is Covid-19?,81
1497,What is covid-19?,81
45,What is the COVID-19?,81
1510,What is COVID-19?,81
1031,what is covid 19,81
1534,what is covid-19,81
1025,Why Covid 19?,81
1240,What is COVID 19,81
1609,Covid-19,81
1131,What is Covid 19,81
1309,How long has the virus been spreading in Canada?,82
1566,What should I do if I have Coronavirus symptoms?,83
1419,what are the symptoms of coronavirus,83
1702,How many cases of coronavirus in Madagascar,84
252,may I know what is corona?,85
1175,how to know that somebody have a corona,85
160,how is going,86
1391,When should I go to the hospital ,86
536,should I go to the hospital?,86
321,Where should I go?,86
1,When should I go to the hospital?,86
213,How does it spread ?,87
223,How long are you contagious if you have Coronavirus?,88
